,Unnamed: 0,Tanggal&Waktu,Username,Clean_text,Tweet_tokenization,Stop_removal,Steaming,Positive,Negative,Neutral,Compound,Sentiment
256,256,2022-06-14 08:34:23+00:00,justgomoon1,       free mint giveaway     azukiart is not only nft  but also a key to mysterious world      congratulations  you are early    ,"['', 'free', 'mint', 'giveaway', 'azukiart', 'is', 'not', 'only', 'nft', 'but', 'also', 'a', 'key', 'to', 'mysterious', 'world', 'congratulations', 'you', 'are', 'early', '']","['free', 'mint', 'giveaway', 'azukiart', 'nft', 'also', 'key', 'mysterious', 'world', 'congratulations', 'early']","['free', 'mint', 'giveaway', 'azukiart', 'nft', 'also', 'key', 'mysterious', 'world', 'congratulations', 'early']",0.319,0.0,0.681,0.8176,Positive
257,257,2022-06-14 08:34:23+00:00,danamac12868580,     big just ape nft giveaway         giveaway     x just ape   nft          to enter        follow   amp  turn on   ,"['', 'big', 'just', 'ape', 'nft', 'giveaway', 'giveaway', 'x', 'just', 'ape', 'nft', 'to', 'enter', 'follow', 'amp', 'turn', 'on', '']","['big', 'ape', 'nft', 'giveaway', 'giveaway', 'x', 'ape', 'nft', 'enter', 'follow', 'amp', 'turn']","['big', 'ape', 'nft', 'giveaway', 'giveaway', 'x', 'ape', 'nft', 'enter', 'follow', 'amp', 'turn']",0.0,0.0,1.0,0.0,Neutral
258,258,2022-06-14 08:34:23+00:00,nell_poppy,     big just ape nft giveaway         giveaway     x just ape   nft          to enter        follow   amp  turn on   ,"['', 'big', 'just', 'ape', 'nft', 'giveaway', 'giveaway', 'x', 'just', 'ape', 'nft', 'to', 'enter', 'follow', 'amp', 'turn', 'on', '']","['big', 'ape', 'nft', 'giveaway', 'giveaway', 'x', 'ape', 'nft', 'enter', 'follow', 'amp', 'turn']","['big', 'ape', 'nft', 'giveaway', 'giveaway', 'x', 'ape', 'nft', 'enter', 'follow', 'amp', 'turn']",0.0,0.0,1.0,0.0,Neutral
259,259,2022-06-14 08:34:23+00:00,darcel93791429,  discord officially opening        gt    gt password    nmp        wl to win    enter discord     like rt fol ,"['', 'discord', 'officially', 'opening', 'gt', 'gt', 'password', 'nmp', 'wl', 'to', 'win', 'enter', 'discord', 'like', 'rt', 'fol', '']","['discord', 'officially', 'opening', 'gt', 'gt', 'password', 'nmp', 'wl', 'win', 'enter', 'discord', 'like', 'rt', 'fol']","['discord', 'officially', 'opening', 'gt', 'gt', 'password', 'nmp', 'wl', 'win', 'enter', 'discord', 'like', 'rt', 'fol']",0.422,0.217,0.361,0.6249,Positive
260,260,2022-06-14 08:34:23+00:00,sagesdickson,    oak paradise wl giveaway       prizes    x   wls    to enter      follow     like      tag   fr ,"['', 'oak', 'paradise', 'wl', 'giveaway', 'prizes', 'x', 'wls', 'to', 'enter', 'follow', 'like', 'tag', 'fr', '']","['oak', 'paradise', 'wl', 'giveaway', 'prizes', 'x', 'wls', 'enter', 'follow', 'like', 'tag', 'fr']","['oak', 'paradise', 'wl', 'giveaway', 'prizes', 'x', 'wls', 'enter', 'follow', 'like', 'tag', 'fr']",0.519,0.0,0.481,0.8658,Positive
261,261,2022-06-14 08:34:22+00:00,carlwil60146553,  discord officially opening        gt    gt password    nmp        wl to win    enter discord     like rt fol ,"['', 'discord', 'officially', 'opening', 'gt', 'gt', 'password', 'nmp', 'wl', 'to', 'win', 'enter', 'discord', 'like', 'rt', 'fol', '']","['discord', 'officially', 'opening', 'gt', 'gt', 'password', 'nmp', 'wl', 'win', 'enter', 'discord', 'like', 'rt', 'fol']","['discord', 'officially', 'opening', 'gt', 'gt', 'password', 'nmp', 'wl', 'win', 'enter', 'discord', 'like', 'rt', 'fol']",0.422,0.217,0.361,0.6249,Positive
262,262,2022-06-14 08:34:22+00:00,stphn00,  mint day is today         don t be this guy  video        giveaway     mint begins  pm  gmt          mints others ,"['', 'mint', 'day', 'is', 'today', 'don', 't', 'be', 'this', 'guy', 'video', 'giveaway', 'mint', 'begins', 'pm', 'gmt', 'mints', 'others', '']","['mint', 'day', 'today', 'guy', 'video', 'giveaway', 'mint', 'begins', 'pm', 'gmt', 'mints', 'others']","['mint', 'day', 'today', 'guy', 'video', 'giveaway', 'mint', 'begins', 'pm', 'gmt', 'mints', 'others']",0.0,0.0,1.0,0.0,Neutral
263,263,2022-06-14 08:34:22+00:00,oxbigwin_wangi,  presale alert   a new chapter         whitelists     enjoy free airdrop nft    open a new web    world game finance socia ,"['', 'presale', 'alert', 'a', 'new', 'chapter', 'whitelists', 'enjoy', 'free', 'airdrop', 'nft', 'open', 'a', 'new', 'web', 'world', 'game', 'finance', 'socia', '']","['presale', 'alert', 'new', 'chapter', 'whitelists', 'enjoy', 'free', 'airdrop', 'nft', 'open', 'new', 'web', 'world', 'game', 'finance', 'socia']","['presale', 'alert', 'new', 'chapter', 'whitelists', 'enjoy', 'free', 'airdrop', 'nft', 'open', 'new', 'web', 'world', 'game', 'finance', 'socia']",0.401,0.0,0.599,0.8271,Positive
264,264,2022-06-14 08:34:22+00:00,alphagirlsales,alpha girl club      has just been bought for       eth   check it out    congrats to our n  ,"['alpha', 'girl', 'club', 'has', 'just', 'been', 'bought', 'for', 'eth', 'check', 'it', 'out', 'congrats', 'to', 'our', 'n', '']","['alpha', 'girl', 'club', 'bought', 'eth', 'check', 'congrats', 'n']","['alpha', 'girl', 'club', 'bought', 'eth', 'check', 'congrats', 'n']",0.195,0.0,0.805,0.5267,Positive
265,265,2022-06-14 08:34:22+00:00,dopmcfntosj,   fairyland  beta   is now live      sign up and join our adventure will get   nft mystery boxes  beta test only      ever ,"['', 'fairyland', 'beta', 'is', 'now', 'live', 'sign', 'up', 'and', 'join', 'our', 'adventure', 'will', 'get', 'nft', 'mystery', 'boxes', 'beta', 'test', 'only', 'ever', '']","['fairyland', 'beta', 'live', 'sign', 'join', 'adventure', 'get', 'nft', 'mystery', 'boxes', 'beta', 'test', 'ever']","['fairyland', 'beta', 'live', 'sign', 'join', 'adventure', 'get', 'nft', 'mystery', 'boxes', 'beta', 'test', 'ever']",0.2,0.0,0.8,0.5423,Positive
266,266,2022-06-14 08:34:22+00:00,dopmcfntosj,  join fairyland beta  game and participate in the bug hunt       send the bug to the email marketing gamewonderlab io    if ,"['', 'join', 'fairyland', 'beta', 'game', 'and', 'participate', 'in', 'the', 'bug', 'hunt', 'send', 'the', 'bug', 'to', 'the', 'email', 'marketing', 'gamewonderlab', 'io', 'if', '']","['join', 'fairyland', 'beta', 'game', 'participate', 'bug', 'hunt', 'send', 'bug', 'email', 'marketing', 'gamewonderlab', 'io']","['join', 'fairyland', 'beta', 'game', 'participate', 'bug', 'hunt', 'send', 'bug', 'email', 'marketing', 'gamewonderlab', 'io']",0.104,0.0,0.896,0.296,Positive
267,267,2022-06-14 08:34:22+00:00,mimmonft,   nft giveaway     to enter      follow   amp            amp        tag   friends who love dogs          we will ,"['', 'nft', 'giveaway', 'to', 'enter', 'follow', 'amp', 'amp', 'tag', 'friends', 'who', 'love', 'dogs', 'we', 'will', '']","['nft', 'giveaway', 'enter', 'follow', 'amp', 'amp', 'tag', 'friends', 'love', 'dogs']","['nft', 'giveaway', 'enter', 'follow', 'amp', 'amp', 'tag', 'friends', 'love', 'dogs']",0.378,0.0,0.622,0.8074,Positive
268,268,2022-06-14 08:34:22+00:00,serio_nft,  yeah this project is the shit   literally ,"['', 'yeah', 'this', 'project', 'is', 'the', 'shit', 'literally', '']","['yeah', 'project', 'shit', 'literally']","['yeah', 'project', 'shit', 'literally']",0.554,0.0,0.446,0.7351,Positive
269,269,2022-06-14 08:34:22+00:00,hughseyin,  i just participated in this weekly event for  nft holders only    i ll be sharin  ,"['', 'i', 'just', 'participated', 'in', 'this', 'weekly', 'event', 'for', 'nft', 'holders', 'only', 'i', 'll', 'be', 'sharin', '']","['participated', 'weekly', 'event', 'nft', 'holders', 'sharin']","['participated', 'weekly', 'event', 'nft', 'holders', 'sharin']",0.0,0.0,1.0,0.0,Neutral
270,270,2022-06-14 08:34:22+00:00,trahnoeldan,  my unsold bees     follow the link            sold           nftcommunity nftart nft nfts nftcolle ,"['', 'my', 'unsold', 'bees', 'follow', 'the', 'link', 'sold', 'nftcommunity', 'nftart', 'nft', 'nfts', 'nftcolle', '']","['unsold', 'bees', 'follow', 'link', 'sold', 'nftcommunity', 'nftart', 'nft', 'nfts', 'nftcolle']","['unsold', 'bees', 'follow', 'link', 'sold', 'nftcommunity', 'nftart', 'nft', 'nfts', 'nftcolle']",0.0,0.0,1.0,0.0,Neutral
271,271,2022-06-14 08:34:21+00:00,atln1998,  nft tagosoul airdrop is officially begun        reward        worth of tago token       slots whitelist nft tagosoul     ,"['', 'nft', 'tagosoul', 'airdrop', 'is', 'officially', 'begun', 'reward', 'worth', 'of', 'tago', 'token', 'slots', 'whitelist', 'nft', 'tagosoul', '']","['nft', 'tagosoul', 'airdrop', 'officially', 'begun', 'reward', 'worth', 'tago', 'token', 'slots', 'whitelist', 'nft', 'tagosoul']","['nft', 'tagosoul', 'airdrop', 'officially', 'begun', 'reward', 'worth', 'tago', 'token', 'slots', 'whitelist', 'nft', 'tagosoul']",0.301,0.0,0.699,0.6808,Positive
272,272,2022-06-14 08:34:21+00:00,danielnftking12,  if you are sac holder you can still order your gravity bong with      discount                         ,"['', 'if', 'you', 'are', 'sac', 'holder', 'you', 'can', 'still', 'order', 'your', 'gravity', 'bong', 'with', 'discount', '']","['sac', 'holder', 'still', 'order', 'gravity', 'bong', 'discount']","['sac', 'holder', 'still', 'order', 'gravity', 'bong', 'discount']",0.0,0.0,1.0,0.0,Neutral
273,273,2022-06-14 08:34:21+00:00,strange8273,  digitalimmortality  nftgiveaway   giving away two heritage collection genesis passes nfts        follow   amp    ,"['', 'digitalimmortality', 'nftgiveaway', 'giving', 'away', 'two', 'heritage', 'collection', 'genesis', 'passes', 'nfts', 'follow', 'amp', '']","['digitalimmortality', 'nftgiveaway', 'giving', 'away', 'two', 'heritage', 'collection', 'genesis', 'passes', 'nfts', 'follow', 'amp']","['digitalimmortality', 'nftgiveaway', 'giving', 'away', 'two', 'heritage', 'collection', 'genesis', 'passes', 'nfts', 'follow', 'amp']",0.179,0.0,0.821,0.34,Positive
274,274,2022-06-14 08:34:21+00:00,rakesh48815053,   runx airdrop    million rnx for   k participants      total airdrop reward   million rnx       rnx each user      rnx per r ,"['', 'runx', 'airdrop', 'million', 'rnx', 'for', 'k', 'participants', 'total', 'airdrop', 'reward', 'million', 'rnx', 'rnx', 'each', 'user', 'rnx', 'per', 'r', '']","['runx', 'airdrop', 'million', 'rnx', 'k', 'participants', 'total', 'airdrop', 'reward', 'million', 'rnx', 'rnx', 'user', 'rnx', 'per', 'r']","['runx', 'airdrop', 'million', 'rnx', 'k', 'participants', 'total', 'airdrop', 'reward', 'million', 'rnx', 'rnx', 'user', 'rnx', 'per', 'r']",0.198,0.0,0.802,0.5719,Positive
275,275,2022-06-14 08:34:21+00:00,albertowongg,    the wait is over  d airdrop  amp  d nft are here      complete a few tasks to get at least    dbits                  k will b ,"['', 'the', 'wait', 'is', 'over', 'd', 'airdrop', 'amp', 'd', 'nft', 'are', 'here', 'complete', 'a', 'few', 'tasks', 'to', 'get', 'at', 'least', 'dbits', 'k', 'will', 'b', '']","['wait', 'airdrop', 'amp', 'nft', 'complete', 'tasks', 'get', 'least', 'dbits', 'k', 'b']","['wait', 'airdrop', 'amp', 'nft', 'complete', 'tasks', 'get', 'least', 'dbits', 'k', 'b']",0.0,0.0,1.0,0.0,Neutral
276,276,2022-06-14 08:34:21+00:00,buun1950,  the  st  uno airdrop is rolling out         ends    th june        prize pool          uno      random winners       uno ,"['', 'the', 'st', 'uno', 'airdrop', 'is', 'rolling', 'out', 'ends', 'th', 'june', 'prize', 'pool', 'uno', 'random', 'winners', 'uno', '']","['st', 'uno', 'airdrop', 'rolling', 'ends', 'th', 'june', 'prize', 'pool', 'uno', 'random', 'winners', 'uno']","['st', 'uno', 'airdrop', 'rolling', 'ends', 'th', 'june', 'prize', 'pool', 'uno', 'random', 'winners', 'uno']",0.314,0.0,0.686,0.7506,Positive
277,277,2022-06-14 08:34:20+00:00,tylerscryypt0,   big nft airdrop   giveaways giveaway nft nftcommunity nfts nftgiveaway        follow   amp  me      ,"['', 'big', 'nft', 'airdrop', 'giveaways', 'giveaway', 'nft', 'nftcommunity', 'nfts', 'nftgiveaway', 'follow', 'amp', 'me', '']","['big', 'nft', 'airdrop', 'giveaways', 'giveaway', 'nft', 'nftcommunity', 'nfts', 'nftgiveaway', 'follow', 'amp']","['big', 'nft', 'airdrop', 'giveaways', 'giveaway', 'nft', 'nftcommunity', 'nfts', 'nftgiveaway', 'follow', 'amp']",0.0,0.0,1.0,0.0,Neutral
278,278,2022-06-14 08:34:20+00:00,termicbravo,       eth in zapes sold      zombieapes are just getting started     wen  verified        wen   comic ,"['', 'eth', 'in', 'zapes', 'sold', 'zombieapes', 'are', 'just', 'getting', 'started', 'wen', 'verified', 'wen', 'comic', '']","['eth', 'zapes', 'sold', 'zombieapes', 'getting', 'started', 'wen', 'verified', 'wen', 'comic']","['eth', 'zapes', 'sold', 'zombieapes', 'getting', 'started', 'wen', 'verified', 'wen', 'comic']",0.0,0.0,1.0,0.0,Neutral
279,279,2022-06-14 08:34:20+00:00,junie_eth,    ,"['', '']",[],[],0.0,0.0,0.0,0.0,Neutral
280,280,2022-06-14 08:34:20+00:00,julieanfgjrytj,    wl giveaway      since the team is launching the full website next week  i m giving away     summon list  wl  spo ,"['', 'wl', 'giveaway', 'since', 'the', 'team', 'is', 'launching', 'the', 'full', 'website', 'next', 'week', 'i', 'm', 'giving', 'away', 'summon', 'list', 'wl', 'spo', '']","['wl', 'giveaway', 'since', 'team', 'launching', 'full', 'website', 'next', 'week', 'giving', 'away', 'summon', 'list', 'wl', 'spo']","['wl', 'giveaway', 'since', 'team', 'launching', 'full', 'website', 'next', 'week', 'giving', 'away', 'summon', 'list', 'wl', 'spo']",0.124,0.0,0.876,0.34,Positive
281,281,2022-06-14 08:34:20+00:00,mfahmi2013,   solana warm up giveaway     prizes       sr nft skins    sol    tap fantasy is going to launching on solana  to enter       follow ,"['', 'solana', 'warm', 'up', 'giveaway', 'prizes', 'sr', 'nft', 'skins', 'sol', 'tap', 'fantasy', 'is', 'going', 'to', 'launching', 'on', 'solana', 'to', 'enter', 'follow', '']","['solana', 'warm', 'giveaway', 'prizes', 'sr', 'nft', 'skins', 'sol', 'tap', 'fantasy', 'going', 'launching', 'solana', 'enter', 'follow']","['solana', 'warm', 'giveaway', 'prizes', 'sr', 'nft', 'skins', 'sol', 'tap', 'fantasy', 'going', 'launching', 'solana', 'enter', 'follow']",0.214,0.0,0.786,0.5994,Positive
282,282,2022-06-14 08:34:20+00:00,lihan4554,    come on  let s go and take a ride      it s finally time  grab your one way ticket      the train will be leaving for downtow ,"['', 'come', 'on', 'let', 's', 'go', 'and', 'take', 'a', 'ride', 'it', 's', 'finally', 'time', 'grab', 'your', 'one', 'way', 'ticket', 'the', 'train', 'will', 'be', 'leaving', 'for', 'downtow', '']","['come', 'let', 'go', 'take', 'ride', 'finally', 'time', 'grab', 'one', 'way', 'ticket', 'train', 'leaving', 'downtow']","['come', 'let', 'go', 'take', 'ride', 'finally', 'time', 'grab', 'one', 'way', 'ticket', 'train', 'leaving', 'downtow']",0.0,0.0,1.0,0.0,Neutral
283,283,2022-06-14 08:34:20+00:00,vivekrawatz,     big wl giveaway         x                   to enter        follow   amp  all acc ,"['', 'big', 'wl', 'giveaway', 'x', 'to', 'enter', 'follow', 'amp', 'all', 'acc', '']","['big', 'wl', 'giveaway', 'x', 'enter', 'follow', 'amp', 'acc']","['big', 'wl', 'giveaway', 'x', 'enter', 'follow', 'amp', 'acc']",0.0,0.0,1.0,0.0,Neutral
284,284,2022-06-14 08:34:20+00:00,andissanford,    oak paradise wl giveaway       prizes    x   wls    to enter      follow     like      tag   fr ,"['', 'oak', 'paradise', 'wl', 'giveaway', 'prizes', 'x', 'wls', 'to', 'enter', 'follow', 'like', 'tag', 'fr', '']","['oak', 'paradise', 'wl', 'giveaway', 'prizes', 'x', 'wls', 'enter', 'follow', 'like', 'tag', 'fr']","['oak', 'paradise', 'wl', 'giveaway', 'prizes', 'x', 'wls', 'enter', 'follow', 'like', 'tag', 'fr']",0.519,0.0,0.481,0.8658,Positive
285,285,2022-06-14 08:34:20+00:00,bhushanvishwas,  gm   with more details from my upcoming nft drop      what do you guys think  ,"['', 'gm', 'with', 'more', 'details', 'from', 'my', 'upcoming', 'nft', 'drop', 'what', 'do', 'you', 'guys', 'think', '']","['gm', 'details', 'upcoming', 'nft', 'drop', 'guys', 'think']","['gm', 'details', 'upcoming', 'nft', 'drop', 'guys', 'think']",0.0,0.139,0.861,-0.2732,Negative
286,286,2022-06-14 08:34:20+00:00,saurabh29980567,    breaking news   metadragnarok announcement    dear metadragnarokers     to focus on developing the metadragnarok and launc ,"['', 'breaking', 'news', 'metadragnarok', 'announcement', 'dear', 'metadragnarokers', 'to', 'focus', 'on', 'developing', 'the', 'metadragnarok', 'and', 'launc', '']","['breaking', 'news', 'metadragnarok', 'announcement', 'dear', 'metadragnarokers', 'focus', 'developing', 'metadragnarok', 'launc']","['breaking', 'news', 'metadragnarok', 'announcement', 'dear', 'metadragnarokers', 'focus', 'developing', 'metadragnarok', 'launc']",0.167,0.0,0.833,0.3818,Positive
287,287,2022-06-14 08:34:19+00:00,fghv4owvwpm4rns,  drop your nft new artists  ,"['', 'drop', 'your', 'nft', 'new', 'artists', '']","['drop', 'nft', 'new', 'artists']","['drop', 'nft', 'new', 'artists']",0.0,0.344,0.656,-0.2732,Negative
288,288,2022-06-14 08:34:19+00:00,zeskucar,  discord raffle       we are dropping our discord channel soon       giving   x spots for guaranteed free mint from this post  ,"['', 'discord', 'raffle', 'we', 'are', 'dropping', 'our', 'discord', 'channel', 'soon', 'giving', 'x', 'spots', 'for', 'guaranteed', 'free', 'mint', 'from', 'this', 'post', '']","['discord', 'raffle', 'dropping', 'discord', 'channel', 'soon', 'giving', 'x', 'spots', 'guaranteed', 'free', 'mint', 'post']","['discord', 'raffle', 'dropping', 'discord', 'channel', 'soon', 'giving', 'x', 'spots', 'guaranteed', 'free', 'mint', 'post']",0.227,0.215,0.558,0.0772,Positive
289,289,2022-06-14 08:34:19+00:00,biggoxoxo,  almost time for olyverse s launch event with     follow our twitter instagr ,"['', 'almost', 'time', 'for', 'olyverse', 's', 'launch', 'event', 'with', 'follow', 'our', 'twitter', 'instagr', '']","['almost', 'time', 'olyverse', 'launch', 'event', 'follow', 'twitter', 'instagr']","['almost', 'time', 'olyverse', 'launch', 'event', 'follow', 'twitter', 'instagr']",0.0,0.0,1.0,0.0,Neutral
290,290,2022-06-14 08:34:19+00:00,nickfabian_nft, good morning   ,"['', 'good', 'morning', '']","['good', 'morning']","['good', 'morning']",0.744,0.0,0.256,0.4404,Positive
291,291,2022-06-14 08:34:19+00:00,ramsey41542848,  drop your  eth address wallet      follow and retweet   free nft      one winner         nftgiveaway nftcommuni ,"['', 'drop', 'your', 'eth', 'address', 'wallet', 'follow', 'and', 'retweet', 'free', 'nft', 'one', 'winner', 'nftgiveaway', 'nftcommuni', '']","['drop', 'eth', 'address', 'wallet', 'follow', 'retweet', 'free', 'nft', 'one', 'winner', 'nftgiveaway', 'nftcommuni']","['drop', 'eth', 'address', 'wallet', 'follow', 'retweet', 'free', 'nft', 'one', 'winner', 'nftgiveaway', 'nftcommuni']",0.351,0.104,0.545,0.7184,Positive
292,292,2022-06-14 08:34:19+00:00,voducminh11,  discord officially opening        gt    gt password    nmp        wl to win    enter discord     like rt fol ,"['', 'discord', 'officially', 'opening', 'gt', 'gt', 'password', 'nmp', 'wl', 'to', 'win', 'enter', 'discord', 'like', 'rt', 'fol', '']","['discord', 'officially', 'opening', 'gt', 'gt', 'password', 'nmp', 'wl', 'win', 'enter', 'discord', 'like', 'rt', 'fol']","['discord', 'officially', 'opening', 'gt', 'gt', 'password', 'nmp', 'wl', 'win', 'enter', 'discord', 'like', 'rt', 'fol']",0.422,0.217,0.361,0.6249,Positive
293,293,2022-06-14 08:34:18+00:00,imrestymins1970,not only will she help you get motivated but also teach you how to make it happen  nft  eth,"['not', 'only', 'will', 'she', 'help', 'you', 'get', 'motivated', 'but', 'also', 'teach', 'you', 'how', 'to', 'make', 'it', 'happen', 'nft', 'eth']","['help', 'get', 'motivated', 'also', 'teach', 'make', 'happen', 'nft', 'eth']","['help', 'get', 'motivated', 'also', 'teach', 'make', 'happen', 'nft', 'eth']",0.185,0.0,0.815,0.431,Positive
294,294,2022-06-14 08:34:18+00:00,visioninss,    lets turn up the heat      for whitelist     theskeletonsarecoming   nft nftcommunity nfts ,"['', 'lets', 'turn', 'up', 'the', 'heat', 'for', 'whitelist', 'theskeletonsarecoming', 'nft', 'nftcommunity', 'nfts', '']","['lets', 'turn', 'heat', 'whitelist', 'theskeletonsarecoming', 'nft', 'nftcommunity', 'nfts']","['lets', 'turn', 'heat', 'whitelist', 'theskeletonsarecoming', 'nft', 'nftcommunity', 'nfts']",0.0,0.0,1.0,0.0,Neutral
295,295,2022-06-14 08:34:18+00:00,darcel93791429,  nft wizards free mint giveaway      announcing their gold  genesis  wizard pass     cost to mint  free  cost of gas  free  uti ,"['', 'nft', 'wizards', 'free', 'mint', 'giveaway', 'announcing', 'their', 'gold', 'genesis', 'wizard', 'pass', 'cost', 'to', 'mint', 'free', 'cost', 'of', 'gas', 'free', 'uti', '']","['nft', 'wizards', 'free', 'mint', 'giveaway', 'announcing', 'gold', 'genesis', 'wizard', 'pass', 'cost', 'mint', 'free', 'cost', 'gas', 'free', 'uti']","['nft', 'wizards', 'free', 'mint', 'giveaway', 'announcing', 'gold', 'genesis', 'wizard', 'pass', 'cost', 'mint', 'free', 'cost', 'gas', 'free', 'uti']",0.368,0.0,0.632,0.872,Positive
296,296,2022-06-14 08:34:18+00:00,aniyahsjoyce,   nft giveaway     prizes     x wl     sol    to enter         follow   amp  me     like  amp      join      e ,"['', 'nft', 'giveaway', 'prizes', 'x', 'wl', 'sol', 'to', 'enter', 'follow', 'amp', 'me', 'like', 'amp', 'join', 'e', '']","['nft', 'giveaway', 'prizes', 'x', 'wl', 'sol', 'enter', 'follow', 'amp', 'like', 'amp', 'join', 'e']","['nft', 'giveaway', 'prizes', 'x', 'wl', 'sol', 'enter', 'follow', 'amp', 'like', 'amp', 'join', 'e']",0.435,0.0,0.565,0.7717,Positive
297,297,2022-06-14 08:34:18+00:00,arijitmondal1, listed my genesis nft  on       black tailed godwit  endangered species  in territorial figh  ,"['', 'listed', 'my', 'genesis', 'nft', 'on', 'black', 'tailed', 'godwit', 'endangered', 'species', 'in', 'territorial', 'figh', '']","['listed', 'genesis', 'nft', 'black', 'tailed', 'godwit', 'endangered', 'species', 'territorial', 'figh']","['listed', 'genesis', 'nft', 'black', 'tailed', 'godwit', 'endangered', 'species', 'territorial', 'figh']",0.0,0.0,1.0,0.0,Neutral
298,298,2022-06-14 08:34:18+00:00,mattepromz,      x wl     airdrops      i ve partnered with    to giveaway   airdrops worth      and   wl to my community        to ent ,"['', 'x', 'wl', 'airdrops', 'i', 've', 'partnered', 'with', 'to', 'giveaway', 'airdrops', 'worth', 'and', 'wl', 'to', 'my', 'community', 'to', 'ent', '']","['x', 'wl', 'airdrops', 'partnered', 'giveaway', 'airdrops', 'worth', 'wl', 'community', 'ent']","['x', 'wl', 'airdrops', 'partnered', 'giveaway', 'airdrops', 'worth', 'wl', 'community', 'ent']",0.112,0.0,0.888,0.2263,Positive
299,299,2022-06-14 08:34:18+00:00,niyongyuandoub1,       free mint giveaway     azukiart is not only nft  but also a key to mysterious world      congratulations  you are early    ,"['', 'free', 'mint', 'giveaway', 'azukiart', 'is', 'not', 'only', 'nft', 'but', 'also', 'a', 'key', 'to', 'mysterious', 'world', 'congratulations', 'you', 'are', 'early', '']","['free', 'mint', 'giveaway', 'azukiart', 'nft', 'also', 'key', 'mysterious', 'world', 'congratulations', 'early']","['free', 'mint', 'giveaway', 'azukiart', 'nft', 'also', 'key', 'mysterious', 'world', 'congratulations', 'early']",0.319,0.0,0.681,0.8176,Positive
300,300,2022-06-14 08:34:17+00:00,txtfullsun,   solana warm up giveaway     prizes       sr nft skins    sol    tap fantasy is going to launching on solana  to enter       follow ,"['', 'solana', 'warm', 'up', 'giveaway', 'prizes', 'sr', 'nft', 'skins', 'sol', 'tap', 'fantasy', 'is', 'going', 'to', 'launching', 'on', 'solana', 'to', 'enter', 'follow', '']","['solana', 'warm', 'giveaway', 'prizes', 'sr', 'nft', 'skins', 'sol', 'tap', 'fantasy', 'going', 'launching', 'solana', 'enter', 'follow']","['solana', 'warm', 'giveaway', 'prizes', 'sr', 'nft', 'skins', 'sol', 'tap', 'fantasy', 'going', 'launching', 'solana', 'enter', 'follow']",0.214,0.0,0.786,0.5994,Positive
301,301,2022-06-14 08:34:17+00:00,nft_in_,  i do recall this being rather interesting   ,"['', 'i', 'do', 'recall', 'this', 'being', 'rather', 'interesting', '']","['recall', 'rather', 'interesting']","['recall', 'rather', 'interesting']",0.351,0.0,0.649,0.4019,Positive
302,302,2022-06-14 08:34:17+00:00,nftshiil,gm   is today we gonna make that nft sale   ,"['gm', 'is', 'today', 'we', 'gonna', 'make', 'that', 'nft', 'sale', '']","['gm', 'today', 'gonna', 'make', 'nft', 'sale']","['gm', 'today', 'gonna', 'make', 'nft', 'sale']",0.0,0.0,1.0,0.0,Neutral
303,303,2022-06-14 08:34:17+00:00,annn__vi,hair   art digitalart portrait applepencil artistontwitter artshare details nft illustration  ,"['hair', 'art', 'digitalart', 'portrait', 'applepencil', 'artistontwitter', 'artshare', 'details', 'nft', 'illustration', '']","['hair', 'art', 'digitalart', 'portrait', 'applepencil', 'artistontwitter', 'artshare', 'details', 'nft', 'illustration']","['hair', 'art', 'digitalart', 'portrait', 'applepencil', 'artistontwitter', 'artshare', 'details', 'nft', 'illustration']",0.0,0.0,1.0,0.0,Neutral
304,304,2022-06-14 08:34:17+00:00,bimasaktiq,  check out  there giving away    sol    make sure to      follow them      tag   friends         rt    nft nfts nft ,"['', 'check', 'out', 'there', 'giving', 'away', 'sol', 'make', 'sure', 'to', 'follow', 'them', 'tag', 'friends', 'rt', 'nft', 'nfts', 'nft', '']","['check', 'giving', 'away', 'sol', 'make', 'sure', 'follow', 'tag', 'friends', 'rt', 'nft', 'nfts', 'nft']","['check', 'giving', 'away', 'sol', 'make', 'sure', 'follow', 'tag', 'friends', 'rt', 'nft', 'nfts', 'nft']",0.358,0.0,0.642,0.7783,Positive
