,Unnamed: 0,Tanggal&Waktu,Username,Clean_text,Tweet_tokenization,Stop_removal,Steaming,Positive,Negative,Neutral,Compound,Sentiment
750,750,2022-06-14 08:33:26+00:00,crypto_fairies,  since i got so much love for my homies at  let s do a giveaway      to enter      like and retweet     tag you ,"['', 'since', 'i', 'got', 'so', 'much', 'love', 'for', 'my', 'homies', 'at', 'let', 's', 'do', 'a', 'giveaway', 'to', 'enter', 'like', 'and', 'retweet', 'tag', 'you', '']","['since', 'got', 'much', 'love', 'homies', 'let', 'giveaway', 'enter', 'like', 'retweet', 'tag']","['since', 'got', 'much', 'love', 'homies', 'let', 'giveaway', 'enter', 'like', 'retweet', 'tag']",0.291,0.0,0.709,0.7893,Positive
751,751,2022-06-14 08:33:26+00:00,shari60529345,    wl giveaway      since the team is launching the full website next week  i m giving away     summon list  wl  spo ,"['', 'wl', 'giveaway', 'since', 'the', 'team', 'is', 'launching', 'the', 'full', 'website', 'next', 'week', 'i', 'm', 'giving', 'away', 'summon', 'list', 'wl', 'spo', '']","['wl', 'giveaway', 'since', 'team', 'launching', 'full', 'website', 'next', 'week', 'giving', 'away', 'summon', 'list', 'wl', 'spo']","['wl', 'giveaway', 'since', 'team', 'launching', 'full', 'website', 'next', 'week', 'giving', 'away', 'summon', 'list', 'wl', 'spo']",0.124,0.0,0.876,0.34,Positive
752,752,2022-06-14 08:33:26+00:00,_flpz_,  we have teamed up with this amazing oriental nft metaverse  and we are giving away   x wl spot        enter the d ,"['', 'we', 'have', 'teamed', 'up', 'with', 'this', 'amazing', 'oriental', 'nft', 'metaverse', 'and', 'we', 'are', 'giving', 'away', 'x', 'wl', 'spot', 'enter', 'the', 'd', '']","['teamed', 'amazing', 'oriental', 'nft', 'metaverse', 'giving', 'away', 'x', 'wl', 'spot', 'enter']","['teamed', 'amazing', 'oriental', 'nft', 'metaverse', 'giving', 'away', 'x', 'wl', 'spot', 'enter']",0.289,0.0,0.711,0.7845,Positive
753,753,2022-06-14 08:33:25+00:00,je11ylee,  thank you for the offer           make offer click  gt  set price  gt  closing after    hours     sell at the highest price ,"['', 'thank', 'you', 'for', 'the', 'offer', 'make', 'offer', 'click', 'gt', 'set', 'price', 'gt', 'closing', 'after', 'hours', 'sell', 'at', 'the', 'highest', 'price', '']","['thank', 'offer', 'make', 'offer', 'click', 'gt', 'set', 'price', 'gt', 'closing', 'hours', 'sell', 'highest', 'price']","['thank', 'offer', 'make', 'offer', 'click', 'gt', 'set', 'price', 'gt', 'closing', 'hours', 'sell', 'highest', 'price']",0.283,0.0,0.717,0.6908,Positive
754,754,2022-06-14 08:33:25+00:00,fidelphuti,    nft airdrop giveaway     airdrop     x  sol    x  nft       sol      x       sol      x  ,"['', 'nft', 'airdrop', 'giveaway', 'airdrop', 'x', 'sol', 'x', 'nft', 'sol', 'x', 'sol', 'x', '']","['nft', 'airdrop', 'giveaway', 'airdrop', 'x', 'sol', 'x', 'nft', 'sol', 'x', 'sol', 'x']","['nft', 'airdrop', 'giveaway', 'airdrop', 'x', 'sol', 'x', 'nft', 'sol', 'x', 'sol', 'x']",0.0,0.0,1.0,0.0,Neutral
755,755,2022-06-14 08:33:25+00:00,rachiguta,  did you know that the united states is ranked no   in having the most nft companies in the country     how many nft companie ,"['', 'did', 'you', 'know', 'that', 'the', 'united', 'states', 'is', 'ranked', 'no', 'in', 'having', 'the', 'most', 'nft', 'companies', 'in', 'the', 'country', 'how', 'many', 'nft', 'companie', '']","['know', 'united', 'states', 'ranked', 'nft', 'companies', 'country', 'many', 'nft', 'companie']","['know', 'united', 'states', 'ranked', 'nft', 'companies', 'country', 'many', 'nft', 'companie']",0.108,0.085,0.808,0.1531,Positive
756,756,2022-06-14 08:33:24+00:00,abollo_x_,   nfts derived from cryptos as cryptos was derivative of forex  nft will come to that stage  when only your ex ,"['', 'nfts', 'derived', 'from', 'cryptos', 'as', 'cryptos', 'was', 'derivative', 'of', 'forex', 'nft', 'will', 'come', 'to', 'that', 'stage', 'when', 'only', 'your', 'ex', '']","['nfts', 'derived', 'cryptos', 'cryptos', 'derivative', 'forex', 'nft', 'come', 'stage', 'ex']","['nfts', 'derived', 'cryptos', 'cryptos', 'derivative', 'forex', 'nft', 'come', 'stage', 'ex']",0.0,0.0,1.0,0.0,Neutral
757,757,2022-06-14 08:33:24+00:00,clairepeg3,    giveaway time      eth is down  so we want to cheer one lucky person up      we are giving away   x luminal genesis nft i ,"['', 'giveaway', 'time', 'eth', 'is', 'down', 'so', 'we', 'want', 'to', 'cheer', 'one', 'lucky', 'person', 'up', 'we', 'are', 'giving', 'away', 'x', 'luminal', 'genesis', 'nft', 'i', '']","['giveaway', 'time', 'eth', 'want', 'cheer', 'one', 'lucky', 'person', 'giving', 'away', 'x', 'luminal', 'genesis', 'nft']","['giveaway', 'time', 'eth', 'want', 'cheer', 'one', 'lucky', 'person', 'giving', 'away', 'x', 'luminal', 'genesis', 'nft']",0.372,0.0,0.628,0.8434,Positive
758,758,2022-06-14 08:33:24+00:00,badbugzclub,  drop your nft    i m buying   today  ,"['', 'drop', 'your', 'nft', 'i', 'm', 'buying', 'today', '']","['drop', 'nft', 'buying', 'today']","['drop', 'nft', 'buying', 'today']",0.0,0.344,0.656,-0.2732,Negative
759,759,2022-06-14 08:33:24+00:00,jarveyrashidul,  discord officially opening        gt    gt password    nmp        wl to win    enter discord     like rt fol ,"['', 'discord', 'officially', 'opening', 'gt', 'gt', 'password', 'nmp', 'wl', 'to', 'win', 'enter', 'discord', 'like', 'rt', 'fol', '']","['discord', 'officially', 'opening', 'gt', 'gt', 'password', 'nmp', 'wl', 'win', 'enter', 'discord', 'like', 'rt', 'fol']","['discord', 'officially', 'opening', 'gt', 'gt', 'password', 'nmp', 'wl', 'win', 'enter', 'discord', 'like', 'rt', 'fol']",0.422,0.217,0.361,0.6249,Positive
760,760,2022-06-14 08:33:24+00:00,elsuave88779308,  gem sweep    ill poop it nft bought for       eth  ,"['', 'gem', 'sweep', 'ill', 'poop', 'it', 'nft', 'bought', 'for', 'eth', '']","['gem', 'sweep', 'ill', 'poop', 'nft', 'bought', 'eth']","['gem', 'sweep', 'ill', 'poop', 'nft', 'bought', 'eth']",0.0,0.259,0.741,-0.4215,Negative
761,761,2022-06-14 08:33:23+00:00,baphowolf,  giveaway       we re giving away  x prime ape planet nft from        to enter      follow     ,"['', 'giveaway', 'we', 're', 'giving', 'away', 'x', 'prime', 'ape', 'planet', 'nft', 'from', 'to', 'enter', 'follow', '']","['giveaway', 'giving', 'away', 'x', 'prime', 'ape', 'planet', 'nft', 'enter', 'follow']","['giveaway', 'giving', 'away', 'x', 'prime', 'ape', 'planet', 'nft', 'enter', 'follow']",0.167,0.0,0.833,0.34,Positive
762,762,2022-06-14 08:33:23+00:00,nfts_multiverse,  motivate and happiness in everyday its like a journey of life         eth   available       open ,"['', 'motivate', 'and', 'happiness', 'in', 'everyday', 'its', 'like', 'a', 'journey', 'of', 'life', 'eth', 'available', 'open', '']","['motivate', 'happiness', 'everyday', 'like', 'journey', 'life', 'eth', 'available', 'open']","['motivate', 'happiness', 'everyday', 'like', 'journey', 'life', 'eth', 'available', 'open']",0.465,0.0,0.535,0.8271,Positive
763,763,2022-06-14 08:33:23+00:00,_nft_baby_, gm gm     have a wonderful day   ,"['', 'gm', 'gm', 'have', 'a', 'wonderful', 'day', '']","['gm', 'gm', 'wonderful', 'day']","['gm', 'gm', 'wonderful', 'day']",0.481,0.0,0.519,0.5719,Positive
764,764,2022-06-14 08:33:23+00:00,sadetuabdullahi, here are our heroes we move ,"['', 'here', 'are', 'our', 'heroes', 'we', 'move', '']","['heroes', 'move']","['heroes', 'move']",0.398,0.0,0.602,0.5106,Positive
765,765,2022-06-14 08:33:23+00:00,stephan_btc,  marvininu stacking  is more commonly used in the field of digital currencies  sticking here means making a profit in exc ,"['', 'marvininu', 'stacking', 'is', 'more', 'commonly', 'used', 'in', 'the', 'field', 'of', 'digital', 'currencies', 'sticking', 'here', 'means', 'making', 'a', 'profit', 'in', 'exc', '']","['marvininu', 'stacking', 'commonly', 'used', 'field', 'digital', 'currencies', 'sticking', 'means', 'making', 'profit', 'exc']","['marvininu', 'stacking', 'commonly', 'used', 'field', 'digital', 'currencies', 'sticking', 'means', 'making', 'profit', 'exc']",0.139,0.0,0.861,0.4404,Positive
766,766,2022-06-14 08:33:23+00:00,crtr_nft,  my unsold bees     follow the link            sold           nftcommunity nftart nft nfts nftcolle ,"['', 'my', 'unsold', 'bees', 'follow', 'the', 'link', 'sold', 'nftcommunity', 'nftart', 'nft', 'nfts', 'nftcolle', '']","['unsold', 'bees', 'follow', 'link', 'sold', 'nftcommunity', 'nftart', 'nft', 'nfts', 'nftcolle']","['unsold', 'bees', 'follow', 'link', 'sold', 'nftcommunity', 'nftart', 'nft', 'nfts', 'nftcolle']",0.0,0.0,1.0,0.0,Neutral
767,767,2022-06-14 08:33:23+00:00,obedscrptdmind, seeing soo much nft related tweets made me think you typed  whitelist   ,"['', 'seeing', 'soo', 'much', 'nft', 'related', 'tweets', 'made', 'me', 'think', 'you', 'typed', 'whitelist', '']","['seeing', 'soo', 'much', 'nft', 'related', 'tweets', 'made', 'think', 'typed', 'whitelist']","['seeing', 'soo', 'much', 'nft', 'related', 'tweets', 'made', 'think', 'typed', 'whitelist']",0.0,0.0,1.0,0.0,Neutral
768,768,2022-06-14 08:33:23+00:00,tylerscryypt0,                                  wl spots       sol           to enter      follow   amp          like   tag ,"['', 'wl', 'spots', 'sol', 'to', 'enter', 'follow', 'amp', 'like', 'tag', '']","['wl', 'spots', 'sol', 'enter', 'follow', 'amp', 'like', 'tag']","['wl', 'spots', 'sol', 'enter', 'follow', 'amp', 'like', 'tag']",0.238,0.0,0.762,0.3612,Positive
769,769,2022-06-14 08:33:23+00:00,pikachu4024,otherdeed bought for                nft  ,"['otherdeed', 'bought', 'for', 'nft', '']","['otherdeed', 'bought', 'nft']","['otherdeed', 'bought', 'nft']",0.0,0.0,1.0,0.0,Neutral
770,770,2022-06-14 08:33:22+00:00,taukuhpjuxickpc,  drop your nft i will support as many as i can,"['', 'drop', 'your', 'nft', 'i', 'will', 'support', 'as', 'many', 'as', 'i', 'can']","['drop', 'nft', 'support', 'many']","['drop', 'nft', 'support', 'many']",0.229,0.178,0.593,0.1531,Positive
771,771,2022-06-14 08:33:22+00:00,overlordrblxtbz, where s adopt me poopy rock nft pet update ,"['', 'where', 's', 'adopt', 'me', 'poopy', 'rock', 'nft', 'pet', 'update', '']","['adopt', 'poopy', 'rock', 'nft', 'pet', 'update']","['adopt', 'poopy', 'rock', 'nft', 'pet', 'update']",0.195,0.0,0.805,0.1779,Positive
772,772,2022-06-14 08:33:22+00:00,madam_suzie_,  an nft collection like no other  with a powerful message of reclaiming stolen african artifacts and paying tribute to the num ,"['', 'an', 'nft', 'collection', 'like', 'no', 'other', 'with', 'a', 'powerful', 'message', 'of', 'reclaiming', 'stolen', 'african', 'artifacts', 'and', 'paying', 'tribute', 'to', 'the', 'num', '']","['nft', 'collection', 'like', 'powerful', 'message', 'reclaiming', 'stolen', 'african', 'artifacts', 'paying', 'tribute', 'num']","['nft', 'collection', 'like', 'powerful', 'message', 'reclaiming', 'stolen', 'african', 'artifacts', 'paying', 'tribute', 'num']",0.199,0.202,0.599,-0.0258,Neutral
773,773,2022-06-14 08:33:22+00:00,ahkgermany,   what do video games  common goods and nft s have in common   they are all key parts of project pringo  private incentives f ,"['', 'what', 'do', 'video', 'games', 'common', 'goods', 'and', 'nft', 's', 'have', 'in', 'common', 'they', 'are', 'all', 'key', 'parts', 'of', 'project', 'pringo', 'private', 'incentives', 'f', '']","['video', 'games', 'common', 'goods', 'nft', 'common', 'key', 'parts', 'project', 'pringo', 'private', 'incentives', 'f']","['video', 'games', 'common', 'goods', 'nft', 'common', 'key', 'parts', 'project', 'pringo', 'private', 'incentives', 'f']",0.103,0.0,0.897,0.3182,Positive
774,774,2022-06-14 08:33:22+00:00,rpf_nft,   ol mm buy   metad  meta world  a few seconds ago ,"['', 'ol', 'mm', 'buy', 'metad', 'meta', 'world', 'a', 'few', 'seconds', 'ago', '']","['ol', 'mm', 'buy', 'metad', 'meta', 'world', 'seconds', 'ago']","['ol', 'mm', 'buy', 'metad', 'meta', 'world', 'seconds', 'ago']",0.0,0.0,1.0,0.0,Neutral
775,775,2022-06-14 08:33:22+00:00,lisankol,  time for character story number      half joe half mecha  this poor bastard has taken a bit of a beating  half his armour ,"['', 'time', 'for', 'character', 'story', 'number', 'half', 'joe', 'half', 'mecha', 'this', 'poor', 'bastard', 'has', 'taken', 'a', 'bit', 'of', 'a', 'beating', 'half', 'his', 'armour', '']","['time', 'character', 'story', 'number', 'half', 'joe', 'half', 'mecha', 'poor', 'bastard', 'taken', 'bit', 'beating', 'half', 'armour']","['time', 'character', 'story', 'number', 'half', 'joe', 'half', 'mecha', 'poor', 'bastard', 'taken', 'bit', 'beating', 'half', 'armour']",0.047,0.369,0.583,-0.8697,Negative
776,776,2022-06-14 08:33:22+00:00,sassyshaski,    nft airdrop giveaway     airdrop     x  sol    x  nft       sol      x       sol      x  ,"['', 'nft', 'airdrop', 'giveaway', 'airdrop', 'x', 'sol', 'x', 'nft', 'sol', 'x', 'sol', 'x', '']","['nft', 'airdrop', 'giveaway', 'airdrop', 'x', 'sol', 'x', 'nft', 'sol', 'x', 'sol', 'x']","['nft', 'airdrop', 'giveaway', 'airdrop', 'x', 'sol', 'x', 'nft', 'sol', 'x', 'sol', 'x']",0.0,0.0,1.0,0.0,Neutral
777,777,2022-06-14 08:33:22+00:00,just_innovation, well my story is an actual story   i create digital comicbooks  i play on anti mimesis through nft plot tw  ,"['', 'well', 'my', 'story', 'is', 'an', 'actual', 'story', 'i', 'create', 'digital', 'comicbooks', 'i', 'play', 'on', 'anti', 'mimesis', 'through', 'nft', 'plot', 'tw', '']","['well', 'story', 'actual', 'story', 'create', 'digital', 'comicbooks', 'play', 'anti', 'mimesis', 'nft', 'plot', 'tw']","['well', 'story', 'actual', 'story', 'create', 'digital', 'comicbooks', 'play', 'anti', 'mimesis', 'nft', 'plot', 'tw']",0.288,0.1,0.611,0.5106,Positive
778,778,2022-06-14 08:33:21+00:00,charis67269908,    wl giveaway      since the team is launching the full website next week  i m giving away     summon list  wl  spo ,"['', 'wl', 'giveaway', 'since', 'the', 'team', 'is', 'launching', 'the', 'full', 'website', 'next', 'week', 'i', 'm', 'giving', 'away', 'summon', 'list', 'wl', 'spo', '']","['wl', 'giveaway', 'since', 'team', 'launching', 'full', 'website', 'next', 'week', 'giving', 'away', 'summon', 'list', 'wl', 'spo']","['wl', 'giveaway', 'since', 'team', 'launching', 'full', 'website', 'next', 'week', 'giving', 'away', 'summon', 'list', 'wl', 'spo']",0.124,0.0,0.876,0.34,Positive
779,779,2022-06-14 08:33:21+00:00,tanucat,   collaboration giveaway      kitsunebi lemontea   we drew the original characters of each other   i will present  jellyfish  ,"['', 'collaboration', 'giveaway', 'kitsunebi', 'lemontea', 'we', 'drew', 'the', 'original', 'characters', 'of', 'each', 'other', 'i', 'will', 'present', 'jellyfish', '']","['collaboration', 'giveaway', 'kitsunebi', 'lemontea', 'drew', 'original', 'characters', 'present', 'jellyfish']","['collaboration', 'giveaway', 'kitsunebi', 'lemontea', 'drew', 'original', 'characters', 'present', 'jellyfish']",0.141,0.0,0.859,0.3182,Positive
780,780,2022-06-14 08:33:21+00:00,yarzar81,  free nft        rt  like and follow   drop  eth address     mint   matic  gt   ,"['', 'free', 'nft', 'rt', 'like', 'and', 'follow', 'drop', 'eth', 'address', 'mint', 'matic', 'gt', '']","['free', 'nft', 'rt', 'like', 'follow', 'drop', 'eth', 'address', 'mint', 'matic', 'gt']","['free', 'nft', 'rt', 'like', 'follow', 'drop', 'eth', 'address', 'mint', 'matic', 'gt']",0.439,0.117,0.444,0.7003,Positive
781,781,2022-06-14 08:33:20+00:00,kittystudiosg,   nft giveaway     to enter      follow   amp            amp        tag   friends who love dogs          we will ,"['', 'nft', 'giveaway', 'to', 'enter', 'follow', 'amp', 'amp', 'tag', 'friends', 'who', 'love', 'dogs', 'we', 'will', '']","['nft', 'giveaway', 'enter', 'follow', 'amp', 'amp', 'tag', 'friends', 'love', 'dogs']","['nft', 'giveaway', 'enter', 'follow', 'amp', 'amp', 'tag', 'friends', 'love', 'dogs']",0.378,0.0,0.622,0.8074,Positive
782,782,2022-06-14 08:33:20+00:00,marnielyenna,  i ve got   more whitelist spots on bapes gen       eth floor      to enter    follow   amp      like  amp    tag   fri ,"['', 'i', 've', 'got', 'more', 'whitelist', 'spots', 'on', 'bapes', 'gen', 'eth', 'floor', 'to', 'enter', 'follow', 'amp', 'like', 'amp', 'tag', 'fri', '']","['got', 'whitelist', 'spots', 'bapes', 'gen', 'eth', 'floor', 'enter', 'follow', 'amp', 'like', 'amp', 'tag', 'fri']","['got', 'whitelist', 'spots', 'bapes', 'gen', 'eth', 'floor', 'enter', 'follow', 'amp', 'like', 'amp', 'tag', 'fri']",0.128,0.0,0.872,0.3612,Positive
783,783,2022-06-14 08:33:20+00:00,sokosoma_nft,  to celebrate my psychedelicskulls mint selling out  i want to celebrate with a cnftgiveaway         x psychedelic skulls ,"['', 'to', 'celebrate', 'my', 'psychedelicskulls', 'mint', 'selling', 'out', 'i', 'want', 'to', 'celebrate', 'with', 'a', 'cnftgiveaway', 'x', 'psychedelic', 'skulls', '']","['celebrate', 'psychedelicskulls', 'mint', 'selling', 'want', 'celebrate', 'cnftgiveaway', 'x', 'psychedelic', 'skulls']","['celebrate', 'psychedelicskulls', 'mint', 'selling', 'want', 'celebrate', 'cnftgiveaway', 'x', 'psychedelic', 'skulls']",0.442,0.0,0.558,0.8271,Positive
784,784,2022-06-14 08:33:20+00:00,blingbits15,  ico of  will end in   days     price is only          upcoming projects   gulf exchange          gulf nft marketpla ,"['', 'ico', 'of', 'will', 'end', 'in', 'days', 'price', 'is', 'only', 'upcoming', 'projects', 'gulf', 'exchange', 'gulf', 'nft', 'marketpla', '']","['ico', 'end', 'days', 'price', 'upcoming', 'projects', 'gulf', 'exchange', 'gulf', 'nft', 'marketpla']","['ico', 'end', 'days', 'price', 'upcoming', 'projects', 'gulf', 'exchange', 'gulf', 'nft', 'marketpla']",0.0,0.0,1.0,0.0,Neutral
785,785,2022-06-14 08:33:20+00:00,0xamber, congratulations  this is big ,"['', 'congratulations', 'this', 'is', 'big', '']","['congratulations', 'big']","['congratulations', 'big']",0.565,0.0,0.435,0.5994,Positive
786,786,2022-06-14 08:33:20+00:00,mdemon29093898,   runx airdrop    million rnx for   k participants      total airdrop reward   million rnx       rnx each user      rnx per r ,"['', 'runx', 'airdrop', 'million', 'rnx', 'for', 'k', 'participants', 'total', 'airdrop', 'reward', 'million', 'rnx', 'rnx', 'each', 'user', 'rnx', 'per', 'r', '']","['runx', 'airdrop', 'million', 'rnx', 'k', 'participants', 'total', 'airdrop', 'reward', 'million', 'rnx', 'rnx', 'user', 'rnx', 'per', 'r']","['runx', 'airdrop', 'million', 'rnx', 'k', 'participants', 'total', 'airdrop', 'reward', 'million', 'rnx', 'rnx', 'user', 'rnx', 'per', 'r']",0.198,0.0,0.802,0.5719,Positive
787,787,2022-06-14 08:33:20+00:00,gummei_01,       magic castle toy collection    zookee told dzw he was the guardian of this magic castle  and  he formed a dancing ban ,"['', 'magic', 'castle', 'toy', 'collection', 'zookee', 'told', 'dzw', 'he', 'was', 'the', 'guardian', 'of', 'this', 'magic', 'castle', 'and', 'he', 'formed', 'a', 'dancing', 'ban', '']","['magic', 'castle', 'toy', 'collection', 'zookee', 'told', 'dzw', 'guardian', 'magic', 'castle', 'formed', 'dancing', 'ban']","['magic', 'castle', 'toy', 'collection', 'zookee', 'told', 'dzw', 'guardian', 'magic', 'castle', 'formed', 'dancing', 'ban']",0.0,0.159,0.841,-0.5574,Negative
788,788,2022-06-14 08:33:20+00:00,taylorback4,       free mint giveaway     azukiart is not only nft  but also a key to mysterious world      congratulations  you are early    ,"['', 'free', 'mint', 'giveaway', 'azukiart', 'is', 'not', 'only', 'nft', 'but', 'also', 'a', 'key', 'to', 'mysterious', 'world', 'congratulations', 'you', 'are', 'early', '']","['free', 'mint', 'giveaway', 'azukiart', 'nft', 'also', 'key', 'mysterious', 'world', 'congratulations', 'early']","['free', 'mint', 'giveaway', 'azukiart', 'nft', 'also', 'key', 'mysterious', 'world', 'congratulations', 'early']",0.319,0.0,0.681,0.8176,Positive
789,789,2022-06-14 08:33:19+00:00,karyadimulya,    nft airdrop giveaway     airdrop     x  sol    x  nft       sol      x       sol      x  ,"['', 'nft', 'airdrop', 'giveaway', 'airdrop', 'x', 'sol', 'x', 'nft', 'sol', 'x', 'sol', 'x', '']","['nft', 'airdrop', 'giveaway', 'airdrop', 'x', 'sol', 'x', 'nft', 'sol', 'x', 'sol', 'x']","['nft', 'airdrop', 'giveaway', 'airdrop', 'x', 'sol', 'x', 'nft', 'sol', 'x', 'sol', 'x']",0.0,0.0,1.0,0.0,Neutral
790,790,2022-06-14 08:33:19+00:00,ayemyou1,   thank you so much for rec ,"['', 'thank', 'you', 'so', 'much', 'for', 'rec', '']","['thank', 'much', 'rec']","['thank', 'much', 'rec']",0.333,0.0,0.667,0.3612,Positive
791,791,2022-06-14 08:33:19+00:00,tylerscryypt0,    degensol nft giveaway        x free nft listed on magiceden     rules       follow me  amp               tag   ,"['', 'degensol', 'nft', 'giveaway', 'x', 'free', 'nft', 'listed', 'on', 'magiceden', 'rules', 'follow', 'me', 'amp', 'tag', '']","['degensol', 'nft', 'giveaway', 'x', 'free', 'nft', 'listed', 'magiceden', 'rules', 'follow', 'amp', 'tag']","['degensol', 'nft', 'giveaway', 'x', 'free', 'nft', 'listed', 'magiceden', 'rules', 'follow', 'amp', 'tag']",0.216,0.0,0.784,0.5106,Positive
792,792,2022-06-14 08:33:19+00:00,starryycious,    reckless racoon club x gangsta goonz       x wl spots for    x wl spots for     to enter        follow ,"['', 'reckless', 'racoon', 'club', 'x', 'gangsta', 'goonz', 'x', 'wl', 'spots', 'for', 'x', 'wl', 'spots', 'for', 'to', 'enter', 'follow', '']","['reckless', 'racoon', 'club', 'x', 'gangsta', 'goonz', 'x', 'wl', 'spots', 'x', 'wl', 'spots', 'enter', 'follow']","['reckless', 'racoon', 'club', 'x', 'gangsta', 'goonz', 'x', 'wl', 'spots', 'x', 'wl', 'spots', 'enter', 'follow']",0.0,0.172,0.828,-0.4019,Negative
793,793,2022-06-14 08:33:19+00:00,maoryoji_nft,good morning  honey      have a wonderful day ,"['good', 'morning', 'honey', 'have', 'a', 'wonderful', 'day', '']","['good', 'morning', 'honey', 'wonderful', 'day']","['good', 'morning', 'honey', 'wonderful', 'day']",0.623,0.0,0.377,0.765,Positive
794,794,2022-06-14 08:33:19+00:00,cushingberryxc,  discord officially opening        gt    gt password    nmp        wl to win    enter discord     like rt fol ,"['', 'discord', 'officially', 'opening', 'gt', 'gt', 'password', 'nmp', 'wl', 'to', 'win', 'enter', 'discord', 'like', 'rt', 'fol', '']","['discord', 'officially', 'opening', 'gt', 'gt', 'password', 'nmp', 'wl', 'win', 'enter', 'discord', 'like', 'rt', 'fol']","['discord', 'officially', 'opening', 'gt', 'gt', 'password', 'nmp', 'wl', 'win', 'enter', 'discord', 'like', 'rt', 'fol']",0.422,0.217,0.361,0.6249,Positive
795,795,2022-06-14 08:33:19+00:00,fleyrrr,  giving away  x alphasharks nft        floor      like rt follow   tag   friends    alphasharks staking and extension are l ,"['', 'giving', 'away', 'x', 'alphasharks', 'nft', 'floor', 'like', 'rt', 'follow', 'tag', 'friends', 'alphasharks', 'staking', 'and', 'extension', 'are', 'l', '']","['giving', 'away', 'x', 'alphasharks', 'nft', 'floor', 'like', 'rt', 'follow', 'tag', 'friends', 'alphasharks', 'staking', 'extension', 'l']","['giving', 'away', 'x', 'alphasharks', 'nft', 'floor', 'like', 'rt', 'follow', 'tag', 'friends', 'alphasharks', 'staking', 'extension', 'l']",0.4,0.0,0.6,0.7906,Positive
796,796,2022-06-14 08:33:19+00:00,_nft_baby_, gm gm     have a wonderful day   ,"['', 'gm', 'gm', 'have', 'a', 'wonderful', 'day', '']","['gm', 'gm', 'wonderful', 'day']","['gm', 'gm', 'wonderful', 'day']",0.481,0.0,0.519,0.5719,Positive
797,797,2022-06-14 08:33:18+00:00,gjdonor,  everrise daily quiz   tuesday june   th       question     the prize is currently an  nft with over         rise ,"['', 'everrise', 'daily', 'quiz', 'tuesday', 'june', 'th', 'question', 'the', 'prize', 'is', 'currently', 'an', 'nft', 'with', 'over', 'rise', '']","['everrise', 'daily', 'quiz', 'tuesday', 'june', 'th', 'question', 'prize', 'currently', 'nft', 'rise']","['everrise', 'daily', 'quiz', 'tuesday', 'june', 'th', 'question', 'prize', 'currently', 'nft', 'rise']",0.18,0.0,0.82,0.5106,Positive
798,798,2022-06-14 08:33:18+00:00,ssaigiridhar, done,"['', 'done']",['done'],['done'],0.0,0.0,1.0,0.0,Neutral
799,799,2022-06-14 08:33:18+00:00,jordan99_nft,  learn the rules like a professional so you can break them like an artist       i am not pro in knowled ,"['', 'learn', 'the', 'rules', 'like', 'a', 'professional', 'so', 'you', 'can', 'break', 'them', 'like', 'an', 'artist', 'i', 'am', 'not', 'pro', 'in', 'knowled', '']","['learn', 'rules', 'like', 'professional', 'break', 'like', 'artist', 'pro', 'knowled']","['learn', 'rules', 'like', 'professional', 'break', 'like', 'artist', 'pro', 'knowled']",0.238,0.0,0.762,0.6124,Positive
800,800,2022-06-14 08:33:18+00:00,royforrosuelo,    ,"['', '']",[],[],0.0,0.0,0.0,0.0,Neutral
801,801,2022-06-14 08:33:18+00:00,0xmoneyfenting_,  fananees v  is finally here    are you excited for the journey     like  and tag your friends for a whitelist spot   fana ,"['', 'fananees', 'v', 'is', 'finally', 'here', 'are', 'you', 'excited', 'for', 'the', 'journey', 'like', 'and', 'tag', 'your', 'friends', 'for', 'a', 'whitelist', 'spot', 'fana', '']","['fananees', 'v', 'finally', 'excited', 'journey', 'like', 'tag', 'friends', 'whitelist', 'spot', 'fana']","['fananees', 'v', 'finally', 'excited', 'journey', 'like', 'tag', 'friends', 'whitelist', 'spot', 'fana']",0.333,0.0,0.667,0.7906,Positive
802,802,2022-06-14 08:33:18+00:00,stephan_btc,  buy your  marvin by now you are already missing lot of good things fill your bag with marvininu now          ,"['', 'buy', 'your', 'marvin', 'by', 'now', 'you', 'are', 'already', 'missing', 'lot', 'of', 'good', 'things', 'fill', 'your', 'bag', 'with', 'marvininu', 'now', '']","['buy', 'marvin', 'already', 'missing', 'lot', 'good', 'things', 'fill', 'bag', 'marvininu']","['buy', 'marvin', 'already', 'missing', 'lot', 'good', 'things', 'fill', 'bag', 'marvininu']",0.131,0.1,0.769,0.1779,Positive
