,Unnamed: 0,Tanggal&Waktu,Username,Clean_text,Tweet_tokenization,Stop_removal,Steaming,Positive,Negative,Neutral,Compound,Sentiment
506,506,2022-06-14 08:33:52+00:00,rnspayumo,  welcome  into the promisphere     ama         pm sgt      is a mafia themed bloc ,"['', 'welcome', 'into', 'the', 'promisphere', 'ama', 'pm', 'sgt', 'is', 'a', 'mafia', 'themed', 'bloc', '']","['welcome', 'promisphere', 'ama', 'pm', 'sgt', 'mafia', 'themed', 'bloc']","['welcome', 'promisphere', 'ama', 'pm', 'sgt', 'mafia', 'themed', 'bloc']",0.231,0.0,0.769,0.4588,Positive
507,507,2022-06-14 08:33:52+00:00,bangsopipud,      x wl     airdrops      i ve partnered with    to giveaway   airdrops worth      and   wl to my community        to ent ,"['', 'x', 'wl', 'airdrops', 'i', 've', 'partnered', 'with', 'to', 'giveaway', 'airdrops', 'worth', 'and', 'wl', 'to', 'my', 'community', 'to', 'ent', '']","['x', 'wl', 'airdrops', 'partnered', 'giveaway', 'airdrops', 'worth', 'wl', 'community', 'ent']","['x', 'wl', 'airdrops', 'partnered', 'giveaway', 'airdrops', 'worth', 'wl', 'community', 'ent']",0.112,0.0,0.888,0.2263,Positive
508,508,2022-06-14 08:33:52+00:00,selaluwangi,    reckless racoon club x gangsta goonz       x wl spots for    x wl spots for     to enter        follow ,"['', 'reckless', 'racoon', 'club', 'x', 'gangsta', 'goonz', 'x', 'wl', 'spots', 'for', 'x', 'wl', 'spots', 'for', 'to', 'enter', 'follow', '']","['reckless', 'racoon', 'club', 'x', 'gangsta', 'goonz', 'x', 'wl', 'spots', 'x', 'wl', 'spots', 'enter', 'follow']","['reckless', 'racoon', 'club', 'x', 'gangsta', 'goonz', 'x', 'wl', 'spots', 'x', 'wl', 'spots', 'enter', 'follow']",0.0,0.172,0.828,-0.4019,Negative
509,509,2022-06-14 08:33:52+00:00,bubu9117,    introducing  pledge mint platform  a new stress free minting experience for busy  high conviction buyers     with  gt     et ,"['', 'introducing', 'pledge', 'mint', 'platform', 'a', 'new', 'stress', 'free', 'minting', 'experience', 'for', 'busy', 'high', 'conviction', 'buyers', 'with', 'gt', 'et', '']","['introducing', 'pledge', 'mint', 'platform', 'new', 'stress', 'free', 'minting', 'experience', 'busy', 'high', 'conviction', 'buyers', 'gt', 'et']","['introducing', 'pledge', 'mint', 'platform', 'new', 'stress', 'free', 'minting', 'experience', 'busy', 'high', 'conviction', 'buyers', 'gt', 'et']",0.243,0.126,0.631,0.3818,Positive
510,510,2022-06-14 08:33:52+00:00,_nft_baby_, gm gm     have a wonderful day   ,"['', 'gm', 'gm', 'have', 'a', 'wonderful', 'day', '']","['gm', 'gm', 'wonderful', 'day']","['gm', 'gm', 'wonderful', 'day']",0.481,0.0,0.519,0.5719,Positive
511,511,2022-06-14 08:33:52+00:00,rhettswenson7,   secret alpha labs x nubbies     we are giving away  x spots     to enter           like       follow    ,"['', 'secret', 'alpha', 'labs', 'x', 'nubbies', 'we', 'are', 'giving', 'away', 'x', 'spots', 'to', 'enter', 'like', 'follow', '']","['secret', 'alpha', 'labs', 'x', 'nubbies', 'giving', 'away', 'x', 'spots', 'enter', 'like', 'follow']","['secret', 'alpha', 'labs', 'x', 'nubbies', 'giving', 'away', 'x', 'spots', 'enter', 'like', 'follow']",0.308,0.0,0.692,0.5994,Positive
512,512,2022-06-14 08:33:52+00:00,ybsfw2,  did you know that the united states is ranked no   in having the most nft companies in the country     how many nft companie ,"['', 'did', 'you', 'know', 'that', 'the', 'united', 'states', 'is', 'ranked', 'no', 'in', 'having', 'the', 'most', 'nft', 'companies', 'in', 'the', 'country', 'how', 'many', 'nft', 'companie', '']","['know', 'united', 'states', 'ranked', 'nft', 'companies', 'country', 'many', 'nft', 'companie']","['know', 'united', 'states', 'ranked', 'nft', 'companies', 'country', 'many', 'nft', 'companie']",0.108,0.085,0.808,0.1531,Positive
513,513,2022-06-14 08:33:51+00:00,unionsv9,    giveaway          free mints worth                     eth    sol       and we are giving away   free mints courtesy of the t ,"['', 'giveaway', 'free', 'mints', 'worth', 'eth', 'sol', 'and', 'we', 'are', 'giving', 'away', 'free', 'mints', 'courtesy', 'of', 'the', 't', '']","['giveaway', 'free', 'mints', 'worth', 'eth', 'sol', 'giving', 'away', 'free', 'mints', 'courtesy']","['giveaway', 'free', 'mints', 'worth', 'eth', 'sol', 'giving', 'away', 'free', 'mints', 'courtesy']",0.549,0.0,0.451,0.9081,Positive
514,514,2022-06-14 08:33:51+00:00,0xjuniwangi,    apaches nft giveaway          wl spots       sol           apaches is a project of dissemination of native american tribes inspire ,"['', 'apaches', 'nft', 'giveaway', 'wl', 'spots', 'sol', 'apaches', 'is', 'a', 'project', 'of', 'dissemination', 'of', 'native', 'american', 'tribes', 'inspire', '']","['apaches', 'nft', 'giveaway', 'wl', 'spots', 'sol', 'apaches', 'project', 'dissemination', 'native', 'american', 'tribes', 'inspire']","['apaches', 'nft', 'giveaway', 'wl', 'spots', 'sol', 'apaches', 'project', 'dissemination', 'native', 'american', 'tribes', 'inspire']",0.198,0.0,0.802,0.5719,Positive
515,515,2022-06-14 08:33:51+00:00,je11ylee,  thank you for the offer          make offer click  gt  set price  gt  closing after    hours     sell at the highest pri ,"['', 'thank', 'you', 'for', 'the', 'offer', 'make', 'offer', 'click', 'gt', 'set', 'price', 'gt', 'closing', 'after', 'hours', 'sell', 'at', 'the', 'highest', 'pri', '']","['thank', 'offer', 'make', 'offer', 'click', 'gt', 'set', 'price', 'gt', 'closing', 'hours', 'sell', 'highest', 'pri']","['thank', 'offer', 'make', 'offer', 'click', 'gt', 'set', 'price', 'gt', 'closing', 'hours', 'sell', 'highest', 'pri']",0.283,0.0,0.717,0.6908,Positive
516,516,2022-06-14 08:33:51+00:00,houseamacentral,      exclusive  baby shark bubblefong friends mystery boxes up for grabs     join now    ,"['', 'exclusive', 'baby', 'shark', 'bubblefong', 'friends', 'mystery', 'boxes', 'up', 'for', 'grabs', 'join', 'now', '']","['exclusive', 'baby', 'shark', 'bubblefong', 'friends', 'mystery', 'boxes', 'grabs', 'join']","['exclusive', 'baby', 'shark', 'bubblefong', 'friends', 'mystery', 'boxes', 'grabs', 'join']",0.43,0.0,0.57,0.7003,Positive
517,517,2022-06-14 08:33:51+00:00,shari60529345,  discord officially opening        gt    gt password    nmp        wl to win    enter discord     like rt fol ,"['', 'discord', 'officially', 'opening', 'gt', 'gt', 'password', 'nmp', 'wl', 'to', 'win', 'enter', 'discord', 'like', 'rt', 'fol', '']","['discord', 'officially', 'opening', 'gt', 'gt', 'password', 'nmp', 'wl', 'win', 'enter', 'discord', 'like', 'rt', 'fol']","['discord', 'officially', 'opening', 'gt', 'gt', 'password', 'nmp', 'wl', 'win', 'enter', 'discord', 'like', 'rt', 'fol']",0.422,0.217,0.361,0.6249,Positive
518,518,2022-06-14 08:33:51+00:00,c_c_nft,  all these goblins and hobos everywhere     where s my sadboys at      eth holder giveaway when we reach     mints      mint y ,"['', 'all', 'these', 'goblins', 'and', 'hobos', 'everywhere', 'where', 's', 'my', 'sadboys', 'at', 'eth', 'holder', 'giveaway', 'when', 'we', 'reach', 'mints', 'mint', 'y', '']","['goblins', 'hobos', 'everywhere', 'sadboys', 'eth', 'holder', 'giveaway', 'reach', 'mints', 'mint']","['goblins', 'hobos', 'everywhere', 'sadboys', 'eth', 'holder', 'giveaway', 'reach', 'mints', 'mint']",0.061,0.0,0.939,0.0258,Neutral
519,519,2022-06-14 08:33:51+00:00,bzusupova,   century social club   alpacadabraz      a web  brand and ecosystem at the intersection of nft  defi  and social networks  ,"['', 'century', 'social', 'club', 'alpacadabraz', 'a', 'web', 'brand', 'and', 'ecosystem', 'at', 'the', 'intersection', 'of', 'nft', 'defi', 'and', 'social', 'networks', '']","['century', 'social', 'club', 'alpacadabraz', 'web', 'brand', 'ecosystem', 'intersection', 'nft', 'defi', 'social', 'networks']","['century', 'social', 'club', 'alpacadabraz', 'web', 'brand', 'ecosystem', 'intersection', 'nft', 'defi', 'social', 'networks']",0.0,0.0,1.0,0.0,Neutral
520,520,2022-06-14 08:33:51+00:00,bapp36551664,    wl giveaway      since the team is launching the full website next week  i m giving away     summon list  wl  spo ,"['', 'wl', 'giveaway', 'since', 'the', 'team', 'is', 'launching', 'the', 'full', 'website', 'next', 'week', 'i', 'm', 'giving', 'away', 'summon', 'list', 'wl', 'spo', '']","['wl', 'giveaway', 'since', 'team', 'launching', 'full', 'website', 'next', 'week', 'giving', 'away', 'summon', 'list', 'wl', 'spo']","['wl', 'giveaway', 'since', 'team', 'launching', 'full', 'website', 'next', 'week', 'giving', 'away', 'summon', 'list', 'wl', 'spo']",0.124,0.0,0.876,0.34,Positive
521,521,2022-06-14 08:33:51+00:00,dangtrungduc11,  did you know that the united states is ranked no   in having the most nft companies in the country     how many nft companie ,"['', 'did', 'you', 'know', 'that', 'the', 'united', 'states', 'is', 'ranked', 'no', 'in', 'having', 'the', 'most', 'nft', 'companies', 'in', 'the', 'country', 'how', 'many', 'nft', 'companie', '']","['know', 'united', 'states', 'ranked', 'nft', 'companies', 'country', 'many', 'nft', 'companie']","['know', 'united', 'states', 'ranked', 'nft', 'companies', 'country', 'many', 'nft', 'companie']",0.108,0.085,0.808,0.1531,Positive
522,522,2022-06-14 08:33:50+00:00,leiannamaeq,    big sol giveaway       prize         in  sol    must       follow me  amp         like  amp       tag   friends        hr     winn ,"['', 'big', 'sol', 'giveaway', 'prize', 'in', 'sol', 'must', 'follow', 'me', 'amp', 'like', 'amp', 'tag', 'friends', 'hr', 'winn', '']","['big', 'sol', 'giveaway', 'prize', 'sol', 'must', 'follow', 'amp', 'like', 'amp', 'tag', 'friends', 'hr', 'winn']","['big', 'sol', 'giveaway', 'prize', 'sol', 'must', 'follow', 'amp', 'like', 'amp', 'tag', 'friends', 'hr', 'winn']",0.406,0.0,0.594,0.836,Positive
523,523,2022-06-14 08:33:50+00:00,socoldmltd,  discord raffle       we are dropping our discord channel soon       giving   x spots for guaranteed free mint from this post  ,"['', 'discord', 'raffle', 'we', 'are', 'dropping', 'our', 'discord', 'channel', 'soon', 'giving', 'x', 'spots', 'for', 'guaranteed', 'free', 'mint', 'from', 'this', 'post', '']","['discord', 'raffle', 'dropping', 'discord', 'channel', 'soon', 'giving', 'x', 'spots', 'guaranteed', 'free', 'mint', 'post']","['discord', 'raffle', 'dropping', 'discord', 'channel', 'soon', 'giving', 'x', 'spots', 'guaranteed', 'free', 'mint', 'post']",0.227,0.215,0.558,0.0772,Positive
524,524,2022-06-14 08:33:50+00:00,santaobeid,     well  we re happy to announce our first ever nft corporate sponsor           known as the region s lea ,"['', 'well', 'we', 're', 'happy', 'to', 'announce', 'our', 'first', 'ever', 'nft', 'corporate', 'sponsor', 'known', 'as', 'the', 'region', 's', 'lea', '']","['well', 'happy', 'announce', 'first', 'ever', 'nft', 'corporate', 'sponsor', 'known', 'region', 'lea']","['well', 'happy', 'announce', 'first', 'ever', 'nft', 'corporate', 'sponsor', 'known', 'region', 'lea']",0.279,0.0,0.721,0.7003,Positive
525,525,2022-06-14 08:33:50+00:00,micseb91,gm    what will we see at crypto and nft today   ,"['gm', 'what', 'will', 'we', 'see', 'at', 'crypto', 'and', 'nft', 'today', '']","['gm', 'see', 'crypto', 'nft', 'today']","['gm', 'see', 'crypto', 'nft', 'today']",0.0,0.0,1.0,0.0,Neutral
526,526,2022-06-14 08:33:50+00:00,y_dist654,   celebrating their public mint of captain planet water rings today at       utc  they are giving away     prize     x  nft      ,"['', 'celebrating', 'their', 'public', 'mint', 'of', 'captain', 'planet', 'water', 'rings', 'today', 'at', 'utc', 'they', 'are', 'giving', 'away', 'prize', 'x', 'nft', '']","['celebrating', 'public', 'mint', 'captain', 'planet', 'water', 'rings', 'today', 'utc', 'giving', 'away', 'prize', 'x', 'nft']","['celebrating', 'public', 'mint', 'captain', 'planet', 'water', 'rings', 'today', 'utc', 'giving', 'away', 'prize', 'x', 'nft']",0.385,0.0,0.615,0.8555,Positive
527,527,2022-06-14 08:33:50+00:00,infinitivesky,                      prizes        x og roles    to enter        follow   amp      like   amp  tag friends      ,"['', 'prizes', 'x', 'og', 'roles', 'to', 'enter', 'follow', 'amp', 'like', 'amp', 'tag', 'friends', '']","['prizes', 'x', 'og', 'roles', 'enter', 'follow', 'amp', 'like', 'amp', 'tag', 'friends']","['prizes', 'x', 'og', 'roles', 'enter', 'follow', 'amp', 'like', 'amp', 'tag', 'friends']",0.518,0.0,0.482,0.8225,Positive
528,528,2022-06-14 08:33:50+00:00,frenkybar,  pls i want to win,"['', 'pls', 'i', 'want', 'to', 'win']","['pls', 'want', 'win']","['pls', 'want', 'win']",0.865,0.0,0.135,0.6597,Positive
529,529,2022-06-14 08:33:50+00:00,chesterwheatle4,     big just ape nft giveaway         giveaway     x just ape   nft          to enter        follow   amp  turn on   ,"['', 'big', 'just', 'ape', 'nft', 'giveaway', 'giveaway', 'x', 'just', 'ape', 'nft', 'to', 'enter', 'follow', 'amp', 'turn', 'on', '']","['big', 'ape', 'nft', 'giveaway', 'giveaway', 'x', 'ape', 'nft', 'enter', 'follow', 'amp', 'turn']","['big', 'ape', 'nft', 'giveaway', 'giveaway', 'x', 'ape', 'nft', 'enter', 'follow', 'amp', 'turn']",0.0,0.0,1.0,0.0,Neutral
530,530,2022-06-14 08:33:50+00:00,andissanford,   nft giveaway     prizes     x wl     sol    to enter         follow   amp  me     like  amp      join      e ,"['', 'nft', 'giveaway', 'prizes', 'x', 'wl', 'sol', 'to', 'enter', 'follow', 'amp', 'me', 'like', 'amp', 'join', 'e', '']","['nft', 'giveaway', 'prizes', 'x', 'wl', 'sol', 'enter', 'follow', 'amp', 'like', 'amp', 'join', 'e']","['nft', 'giveaway', 'prizes', 'x', 'wl', 'sol', 'enter', 'follow', 'amp', 'like', 'amp', 'join', 'e']",0.435,0.0,0.565,0.7717,Positive
531,531,2022-06-14 08:33:49+00:00,bethhoo83863622,  nft wizards free mint giveaway      announcing their gold  genesis  wizard pass     cost to mint  free  cost of gas  free  uti ,"['', 'nft', 'wizards', 'free', 'mint', 'giveaway', 'announcing', 'their', 'gold', 'genesis', 'wizard', 'pass', 'cost', 'to', 'mint', 'free', 'cost', 'of', 'gas', 'free', 'uti', '']","['nft', 'wizards', 'free', 'mint', 'giveaway', 'announcing', 'gold', 'genesis', 'wizard', 'pass', 'cost', 'mint', 'free', 'cost', 'gas', 'free', 'uti']","['nft', 'wizards', 'free', 'mint', 'giveaway', 'announcing', 'gold', 'genesis', 'wizard', 'pass', 'cost', 'mint', 'free', 'cost', 'gas', 'free', 'uti']",0.368,0.0,0.632,0.872,Positive
532,532,2022-06-14 08:33:49+00:00,else47137769,    sl giveaway      i heard the team is launching the full website next week  i m dropping     summon list  wl  spots ,"['', 'sl', 'giveaway', 'i', 'heard', 'the', 'team', 'is', 'launching', 'the', 'full', 'website', 'next', 'week', 'i', 'm', 'dropping', 'summon', 'list', 'wl', 'spots', '']","['sl', 'giveaway', 'heard', 'team', 'launching', 'full', 'website', 'next', 'week', 'dropping', 'summon', 'list', 'wl', 'spots']","['sl', 'giveaway', 'heard', 'team', 'launching', 'full', 'website', 'next', 'week', 'dropping', 'summon', 'list', 'wl', 'spots']",0.0,0.0,1.0,0.0,Neutral
533,533,2022-06-14 08:33:49+00:00,melody46329085,  nft wizards free mint giveaway      announcing their gold  genesis  wizard pass     cost to mint  free  cost of gas  free  uti ,"['', 'nft', 'wizards', 'free', 'mint', 'giveaway', 'announcing', 'their', 'gold', 'genesis', 'wizard', 'pass', 'cost', 'to', 'mint', 'free', 'cost', 'of', 'gas', 'free', 'uti', '']","['nft', 'wizards', 'free', 'mint', 'giveaway', 'announcing', 'gold', 'genesis', 'wizard', 'pass', 'cost', 'mint', 'free', 'cost', 'gas', 'free', 'uti']","['nft', 'wizards', 'free', 'mint', 'giveaway', 'announcing', 'gold', 'genesis', 'wizard', 'pass', 'cost', 'mint', 'free', 'cost', 'gas', 'free', 'uti']",0.368,0.0,0.632,0.872,Positive
534,534,2022-06-14 08:33:49+00:00,morganacash,   solana giveaway            in  sol or  usdt     enter            follow           my pinned tweet       winne ,"['', 'solana', 'giveaway', 'in', 'sol', 'or', 'usdt', 'enter', 'follow', 'my', 'pinned', 'tweet', 'winne', '']","['solana', 'giveaway', 'sol', 'usdt', 'enter', 'follow', 'pinned', 'tweet', 'winne']","['solana', 'giveaway', 'sol', 'usdt', 'enter', 'follow', 'pinned', 'tweet', 'winne']",0.0,0.0,1.0,0.0,Neutral
535,535,2022-06-14 08:33:49+00:00,_crypto_alerts,   crypto alert       macd cross alert    m     pair  qtum usdt     ipo crypto coinbase nft cryptocurrency     ,"['', 'crypto', 'alert', 'macd', 'cross', 'alert', 'm', 'pair', 'qtum', 'usdt', 'ipo', 'crypto', 'coinbase', 'nft', 'cryptocurrency', '']","['crypto', 'alert', 'macd', 'cross', 'alert', 'pair', 'qtum', 'usdt', 'ipo', 'crypto', 'coinbase', 'nft', 'cryptocurrency']","['crypto', 'alert', 'macd', 'cross', 'alert', 'pair', 'qtum', 'usdt', 'ipo', 'crypto', 'coinbase', 'nft', 'cryptocurrency']",0.286,0.0,0.714,0.5267,Positive
536,536,2022-06-14 08:33:49+00:00,cryptoantone,   bigfoot town x apple       x  sol    x wl bigfoot town      to enter       follow    amp    amp   ,"['', 'bigfoot', 'town', 'x', 'apple', 'x', 'sol', 'x', 'wl', 'bigfoot', 'town', 'to', 'enter', 'follow', 'amp', 'amp', '']","['bigfoot', 'town', 'x', 'apple', 'x', 'sol', 'x', 'wl', 'bigfoot', 'town', 'enter', 'follow', 'amp', 'amp']","['bigfoot', 'town', 'x', 'apple', 'x', 'sol', 'x', 'wl', 'bigfoot', 'town', 'enter', 'follow', 'amp', 'amp']",0.0,0.0,1.0,0.0,Neutral
537,537,2022-06-14 08:33:49+00:00,mattpvdoom,  free mint raffle is finally here     let your dreams begin  you have   hours to enter        nftart n ,"['', 'free', 'mint', 'raffle', 'is', 'finally', 'here', 'let', 'your', 'dreams', 'begin', 'you', 'have', 'hours', 'to', 'enter', 'nftart', 'n', '']","['free', 'mint', 'raffle', 'finally', 'let', 'dreams', 'begin', 'hours', 'enter', 'nftart', 'n']","['free', 'mint', 'raffle', 'finally', 'let', 'dreams', 'begin', 'hours', 'enter', 'nftart', 'n']",0.3,0.0,0.7,0.7184,Positive
538,538,2022-06-14 08:33:48+00:00,luryluxury,you are still very early     follow     og    nft nftcommunity ,"['you', 'are', 'still', 'very', 'early', 'follow', 'og', 'nft', 'nftcommunity', '']","['still', 'early', 'follow', 'og', 'nft', 'nftcommunity']","['still', 'early', 'follow', 'og', 'nft', 'nftcommunity']",0.0,0.0,1.0,0.0,Neutral
539,539,2022-06-14 08:33:48+00:00,man_carlife, this is definitely going to be huge  as the team has been an inspiration in their innovative approaches  ,"['', 'this', 'is', 'definitely', 'going', 'to', 'be', 'huge', 'as', 'the', 'team', 'has', 'been', 'an', 'inspiration', 'in', 'their', 'innovative', 'approaches', '']","['definitely', 'going', 'huge', 'team', 'inspiration', 'innovative', 'approaches']","['definitely', 'going', 'huge', 'team', 'inspiration', 'innovative', 'approaches']",0.447,0.0,0.553,0.8834,Positive
540,540,2022-06-14 08:33:48+00:00,farid94099,  nft tagosoul airdrop is officially begun        reward        worth of tago token       slots whitelist nft tagosoul     ,"['', 'nft', 'tagosoul', 'airdrop', 'is', 'officially', 'begun', 'reward', 'worth', 'of', 'tago', 'token', 'slots', 'whitelist', 'nft', 'tagosoul', '']","['nft', 'tagosoul', 'airdrop', 'officially', 'begun', 'reward', 'worth', 'tago', 'token', 'slots', 'whitelist', 'nft', 'tagosoul']","['nft', 'tagosoul', 'airdrop', 'officially', 'begun', 'reward', 'worth', 'tago', 'token', 'slots', 'whitelist', 'nft', 'tagosoul']",0.301,0.0,0.699,0.6808,Positive
541,541,2022-06-14 08:33:48+00:00,0xyyds,  abga fan club nft giveaway      our partner abga  co sponsored by leading institutions in gaming and blockchain  is buildi ,"['', 'abga', 'fan', 'club', 'nft', 'giveaway', 'our', 'partner', 'abga', 'co', 'sponsored', 'by', 'leading', 'institutions', 'in', 'gaming', 'and', 'blockchain', 'is', 'buildi', '']","['abga', 'fan', 'club', 'nft', 'giveaway', 'partner', 'abga', 'co', 'sponsored', 'leading', 'institutions', 'gaming', 'blockchain', 'buildi']","['abga', 'fan', 'club', 'nft', 'giveaway', 'partner', 'abga', 'co', 'sponsored', 'leading', 'institutions', 'gaming', 'blockchain', 'buildi']",0.113,0.0,0.887,0.3182,Positive
542,542,2022-06-14 08:33:48+00:00,matafonovandrey,  magiccrafters  make sure you re not missing out  mcnft genesis collection      mint your mages  archers and warriors ,"['', 'magiccrafters', 'make', 'sure', 'you', 're', 'not', 'missing', 'out', 'mcnft', 'genesis', 'collection', 'mint', 'your', 'mages', 'archers', 'and', 'warriors', '']","['magiccrafters', 'make', 'sure', 'missing', 'mcnft', 'genesis', 'collection', 'mint', 'mages', 'archers', 'warriors']","['magiccrafters', 'make', 'sure', 'missing', 'mcnft', 'genesis', 'collection', 'mint', 'mages', 'archers', 'warriors']",0.218,0.0,0.782,0.4919,Positive
543,543,2022-06-14 08:33:48+00:00,tucnguy21141451,  nft tagosoul airdrop is officially begun        reward        worth of tago token       slots whitelist nft tagosoul     ,"['', 'nft', 'tagosoul', 'airdrop', 'is', 'officially', 'begun', 'reward', 'worth', 'of', 'tago', 'token', 'slots', 'whitelist', 'nft', 'tagosoul', '']","['nft', 'tagosoul', 'airdrop', 'officially', 'begun', 'reward', 'worth', 'tago', 'token', 'slots', 'whitelist', 'nft', 'tagosoul']","['nft', 'tagosoul', 'airdrop', 'officially', 'begun', 'reward', 'worth', 'tago', 'token', 'slots', 'whitelist', 'nft', 'tagosoul']",0.301,0.0,0.699,0.6808,Positive
544,544,2022-06-14 08:33:48+00:00,lolalolababi,  this is my last doodle at gangnam  korea inspired by the upcoming dracoo champion series      dracoo master esports  w ,"['', 'this', 'is', 'my', 'last', 'doodle', 'at', 'gangnam', 'korea', 'inspired', 'by', 'the', 'upcoming', 'dracoo', 'champion', 'series', 'dracoo', 'master', 'esports', 'w', '']","['last', 'doodle', 'gangnam', 'korea', 'inspired', 'upcoming', 'dracoo', 'champion', 'series', 'dracoo', 'master', 'esports', 'w']","['last', 'doodle', 'gangnam', 'korea', 'inspired', 'upcoming', 'dracoo', 'champion', 'series', 'dracoo', 'master', 'esports', 'w']",0.307,0.0,0.693,0.7964,Positive
545,545,2022-06-14 08:33:48+00:00,antoattorre,congrats on the feature       get highlighted close by top pioneers  amp  projects in crypto nft     become thousands of fi  ,"['congrats', 'on', 'the', 'feature', 'get', 'highlighted', 'close', 'by', 'top', 'pioneers', 'amp', 'projects', 'in', 'crypto', 'nft', 'become', 'thousands', 'of', 'fi', '']","['congrats', 'feature', 'get', 'highlighted', 'close', 'top', 'pioneers', 'amp', 'projects', 'crypto', 'nft', 'become', 'thousands', 'fi']","['congrats', 'feature', 'get', 'highlighted', 'close', 'top', 'pioneers', 'amp', 'projects', 'crypto', 'nft', 'become', 'thousands', 'fi']",0.234,0.0,0.766,0.6369,Positive
546,546,2022-06-14 08:33:48+00:00,0xohhpee,  i know you want more   that s why i m giving away another gobween         by  nft giveaway       rules    lik ,"['', 'i', 'know', 'you', 'want', 'more', 'that', 's', 'why', 'i', 'm', 'giving', 'away', 'another', 'gobween', 'by', 'nft', 'giveaway', 'rules', 'lik', '']","['know', 'want', 'giving', 'away', 'another', 'gobween', 'nft', 'giveaway', 'rules', 'lik']","['know', 'want', 'giving', 'away', 'another', 'gobween', 'nft', 'giveaway', 'rules', 'lik']",0.234,0.0,0.766,0.4522,Positive
547,547,2022-06-14 08:33:47+00:00,tylerscryypt0,  the  th sneak peek  dark element      wl giveaway      follow     like  rt  tag   friends   join our discord  htt ,"['', 'the', 'th', 'sneak', 'peek', 'dark', 'element', 'wl', 'giveaway', 'follow', 'like', 'rt', 'tag', 'friends', 'join', 'our', 'discord', 'htt', '']","['th', 'sneak', 'peek', 'dark', 'element', 'wl', 'giveaway', 'follow', 'like', 'rt', 'tag', 'friends', 'join', 'discord', 'htt']","['th', 'sneak', 'peek', 'dark', 'element', 'wl', 'giveaway', 'follow', 'like', 'rt', 'tag', 'friends', 'join', 'discord', 'htt']",0.332,0.115,0.553,0.6249,Positive
548,548,2022-06-14 08:33:47+00:00,joker39133978,   yoleeuniverse ido on  has finished    thank you for your participation   o e nft gamefi ,"['', 'yoleeuniverse', 'ido', 'on', 'has', 'finished', 'thank', 'you', 'for', 'your', 'participation', 'o', 'e', 'nft', 'gamefi', '']","['yoleeuniverse', 'ido', 'finished', 'thank', 'participation', 'e', 'nft', 'gamefi']","['yoleeuniverse', 'ido', 'finished', 'thank', 'participation', 'e', 'nft', 'gamefi']",0.185,0.0,0.815,0.3612,Positive
549,549,2022-06-14 08:33:47+00:00,adekunleddream,  trove alpha has officially launched     as the successor to the treasure marketplace  trove is the leading nft marketpla ,"['', 'trove', 'alpha', 'has', 'officially', 'launched', 'as', 'the', 'successor', 'to', 'the', 'treasure', 'marketplace', 'trove', 'is', 'the', 'leading', 'nft', 'marketpla', '']","['trove', 'alpha', 'officially', 'launched', 'successor', 'treasure', 'marketplace', 'trove', 'leading', 'nft', 'marketpla']","['trove', 'alpha', 'officially', 'launched', 'successor', 'treasure', 'marketplace', 'trove', 'leading', 'nft', 'marketpla']",0.272,0.0,0.728,0.5574,Positive
550,550,2022-06-14 08:33:47+00:00,derallwissender,check out my item listing on opensea   via  nftcollector nftdrop nftproject  ,"['check', 'out', 'my', 'item', 'listing', 'on', 'opensea', 'via', 'nftcollector', 'nftdrop', 'nftproject', '']","['check', 'item', 'listing', 'opensea', 'via', 'nftcollector', 'nftdrop', 'nftproject']","['check', 'item', 'listing', 'opensea', 'via', 'nftcollector', 'nftdrop', 'nftproject']",0.0,0.0,1.0,0.0,Neutral
551,551,2022-06-14 08:33:47+00:00,shaneka20441860,  discord officially opening        gt    gt password    nmp        wl to win    enter discord     like rt fol ,"['', 'discord', 'officially', 'opening', 'gt', 'gt', 'password', 'nmp', 'wl', 'to', 'win', 'enter', 'discord', 'like', 'rt', 'fol', '']","['discord', 'officially', 'opening', 'gt', 'gt', 'password', 'nmp', 'wl', 'win', 'enter', 'discord', 'like', 'rt', 'fol']","['discord', 'officially', 'opening', 'gt', 'gt', 'password', 'nmp', 'wl', 'win', 'enter', 'discord', 'like', 'rt', 'fol']",0.422,0.217,0.361,0.6249,Positive
