,Unnamed: 0,Tanggal&Waktu,Username,Clean_text,Tweet_tokenization,Stop_removal,Steaming,Positive,Negative,Neutral,Compound,Sentiment
0,0,2022-06-14 08:34:52+00:00,iammasterblade,      wl spots  giveaway        like and    follow  and      tag   friends       ,"['', 'wl', 'spots', 'giveaway', 'like', 'and', 'follow', 'and', 'tag', 'friends', '']","['wl', 'spots', 'giveaway', 'like', 'follow', 'tag', 'friends']","['wl', 'spots', 'giveaway', 'like', 'follow', 'tag', 'friends']",0.444,0.0,0.556,0.6808,Positive
1,1,2022-06-14 08:34:51+00:00,naehrstff_nft, some true words here  where in the world are you my friend    ,"['', 'some', 'true', 'words', 'here', 'where', 'in', 'the', 'world', 'are', 'you', 'my', 'friend', '']","['true', 'words', 'world', 'friend']","['true', 'words', 'world', 'friend']",0.375,0.0,0.625,0.7184,Positive
2,2,2022-06-14 08:34:51+00:00,mdzahid85418836,   runx airdrop    million rnx for   k participants      total airdrop reward   million rnx       rnx each user      rnx per r ,"['', 'runx', 'airdrop', 'million', 'rnx', 'for', 'k', 'participants', 'total', 'airdrop', 'reward', 'million', 'rnx', 'rnx', 'each', 'user', 'rnx', 'per', 'r', '']","['runx', 'airdrop', 'million', 'rnx', 'k', 'participants', 'total', 'airdrop', 'reward', 'million', 'rnx', 'rnx', 'user', 'rnx', 'per', 'r']","['runx', 'airdrop', 'million', 'rnx', 'k', 'participants', 'total', 'airdrop', 'reward', 'million', 'rnx', 'rnx', 'user', 'rnx', 'per', 'r']",0.198,0.0,0.802,0.5719,Positive
3,3,2022-06-14 08:34:51+00:00,annelie00284967,  discord officially opening        gt    gt password    nmp        wl to win    enter discord     like rt fol ,"['', 'discord', 'officially', 'opening', 'gt', 'gt', 'password', 'nmp', 'wl', 'to', 'win', 'enter', 'discord', 'like', 'rt', 'fol', '']","['discord', 'officially', 'opening', 'gt', 'gt', 'password', 'nmp', 'wl', 'win', 'enter', 'discord', 'like', 'rt', 'fol']","['discord', 'officially', 'opening', 'gt', 'gt', 'password', 'nmp', 'wl', 'win', 'enter', 'discord', 'like', 'rt', 'fol']",0.422,0.217,0.361,0.6249,Positive
4,4,2022-06-14 08:34:51+00:00,tkirwi,  discord officially opening        gt    gt password    nmp        wl to win    enter discord     like rt fol ,"['', 'discord', 'officially', 'opening', 'gt', 'gt', 'password', 'nmp', 'wl', 'to', 'win', 'enter', 'discord', 'like', 'rt', 'fol', '']","['discord', 'officially', 'opening', 'gt', 'gt', 'password', 'nmp', 'wl', 'win', 'enter', 'discord', 'like', 'rt', 'fol']","['discord', 'officially', 'opening', 'gt', 'gt', 'password', 'nmp', 'wl', 'win', 'enter', 'discord', 'like', 'rt', 'fol']",0.422,0.217,0.361,0.6249,Positive
5,5,2022-06-14 08:34:51+00:00,jonas18931520,  it s not too late to join the  for the culture    the team has been nonstop at work pushing the bounds of the nft space  ,"['', 'it', 's', 'not', 'too', 'late', 'to', 'join', 'the', 'for', 'the', 'culture', 'the', 'team', 'has', 'been', 'nonstop', 'at', 'work', 'pushing', 'the', 'bounds', 'of', 'the', 'nft', 'space', '']","['late', 'join', 'culture', 'team', 'nonstop', 'work', 'pushing', 'bounds', 'nft', 'space']","['late', 'join', 'culture', 'team', 'nonstop', 'work', 'pushing', 'bounds', 'nft', 'space']",0.087,0.0,0.913,0.296,Positive
6,6,2022-06-14 08:34:51+00:00,houseamacentral,  subscription for  binaryx igo   rh nox is now live     prepare bnx in your spot wallet and subscribe for particip ,"['', 'subscription', 'for', 'binaryx', 'igo', 'rh', 'nox', 'is', 'now', 'live', 'prepare', 'bnx', 'in', 'your', 'spot', 'wallet', 'and', 'subscribe', 'for', 'particip', '']","['subscription', 'binaryx', 'igo', 'rh', 'nox', 'live', 'prepare', 'bnx', 'spot', 'wallet', 'subscribe', 'particip']","['subscription', 'binaryx', 'igo', 'rh', 'nox', 'live', 'prepare', 'bnx', 'spot', 'wallet', 'subscribe', 'particip']",0.0,0.0,1.0,0.0,Neutral
7,7,2022-06-14 08:34:51+00:00,cryptoxplora,  came such a long way   mint is in less than    hours    can t wait to start building with the  fam      catch y all do ,"['', 'came', 'such', 'a', 'long', 'way', 'mint', 'is', 'in', 'less', 'than', 'hours', 'can', 't', 'wait', 'to', 'start', 'building', 'with', 'the', 'fam', 'catch', 'y', 'all', 'do', '']","['came', 'long', 'way', 'mint', 'less', 'hours', 'wait', 'start', 'building', 'fam', 'catch']","['came', 'long', 'way', 'mint', 'less', 'hours', 'wait', 'start', 'building', 'fam', 'catch']",0.0,0.0,1.0,0.0,Neutral
8,8,2022-06-14 08:34:50+00:00,animalsfarm_nft,  check out my new item on opensea   via ,"['', 'check', 'out', 'my', 'new', 'item', 'on', 'opensea', 'via', '']","['check', 'new', 'item', 'opensea', 'via']","['check', 'new', 'item', 'opensea', 'via']",0.0,0.0,1.0,0.0,Neutral
9,9,2022-06-14 08:34:50+00:00,missufehan,   top news nft  nftcommunity   openseanft our top pick this week  filthy merica  our grade a   floor price  live free mint ,"['', 'top', 'news', 'nft', 'nftcommunity', 'openseanft', 'our', 'top', 'pick', 'this', 'week', 'filthy', 'merica', 'our', 'grade', 'a', 'floor', 'price', 'live', 'free', 'mint', '']","['top', 'news', 'nft', 'nftcommunity', 'openseanft', 'top', 'pick', 'week', 'filthy', 'merica', 'grade', 'floor', 'price', 'live', 'free', 'mint']","['top', 'news', 'nft', 'nftcommunity', 'openseanft', 'top', 'pick', 'week', 'filthy', 'merica', 'grade', 'floor', 'price', 'live', 'free', 'mint']",0.301,0.0,0.699,0.7096,Positive
10,10,2022-06-14 08:34:50+00:00,y_dist654,    another giveaway      geeks team has made this one specially for         lucky ninjas will share      inj     ,"['', 'another', 'giveaway', 'geeks', 'team', 'has', 'made', 'this', 'one', 'specially', 'for', 'lucky', 'ninjas', 'will', 'share', 'inj', '']","['another', 'giveaway', 'geeks', 'team', 'made', 'one', 'specially', 'lucky', 'ninjas', 'share', 'inj']","['another', 'giveaway', 'geeks', 'team', 'made', 'one', 'specially', 'lucky', 'ninjas', 'share', 'inj']",0.272,0.076,0.652,0.5574,Positive
11,11,2022-06-14 08:34:50+00:00,octavio_whybrew,  big announcement will be made on discord today  we want to hook up the undead community by giving away         x free mi ,"['', 'big', 'announcement', 'will', 'be', 'made', 'on', 'discord', 'today', 'we', 'want', 'to', 'hook', 'up', 'the', 'undead', 'community', 'by', 'giving', 'away', 'x', 'free', 'mi', '']","['big', 'announcement', 'made', 'discord', 'today', 'want', 'hook', 'undead', 'community', 'giving', 'away', 'x', 'free', 'mi']","['big', 'announcement', 'made', 'discord', 'today', 'want', 'hook', 'undead', 'community', 'giving', 'away', 'x', 'free', 'mi']",0.262,0.101,0.637,0.5106,Positive
12,12,2022-06-14 08:34:50+00:00,japapan320,  the time has come to be the one and only proud owner of a  d unique  animated egg nft     you will be ,"['', 'the', 'time', 'has', 'come', 'to', 'be', 'the', 'one', 'and', 'only', 'proud', 'owner', 'of', 'a', 'd', 'unique', 'animated', 'egg', 'nft', 'you', 'will', 'be', '']","['time', 'come', 'one', 'proud', 'owner', 'unique', 'animated', 'egg', 'nft']","['time', 'come', 'one', 'proud', 'owner', 'unique', 'animated', 'egg', 'nft']",0.14,0.0,0.86,0.4767,Positive
13,13,2022-06-14 08:34:50+00:00,amirshz1399,   the first  hari airdrop is rolling out       ends    th june        prize pool        usd worth in token  hari   winner  ,"['', 'the', 'first', 'hari', 'airdrop', 'is', 'rolling', 'out', 'ends', 'th', 'june', 'prize', 'pool', 'usd', 'worth', 'in', 'token', 'hari', 'winner', '']","['first', 'hari', 'airdrop', 'rolling', 'ends', 'th', 'june', 'prize', 'pool', 'usd', 'worth', 'token', 'hari', 'winner']","['first', 'hari', 'airdrop', 'rolling', 'ends', 'th', 'june', 'prize', 'pool', 'usd', 'worth', 'token', 'hari', 'winner']",0.375,0.0,0.625,0.8402,Positive
14,14,2022-06-14 08:34:50+00:00,bitcoin_bing,  bitcoin is not crypto    proof of stake is a scam  web  is just a marketing buzzword  your nft is going to zero  your stablecoin ,"['', 'bitcoin', 'is', 'not', 'crypto', 'proof', 'of', 'stake', 'is', 'a', 'scam', 'web', 'is', 'just', 'a', 'marketing', 'buzzword', 'your', 'nft', 'is', 'going', 'to', 'zero', 'your', 'stablecoin', '']","['bitcoin', 'crypto', 'proof', 'stake', 'scam', 'web', 'marketing', 'buzzword', 'nft', 'going', 'zero', 'stablecoin']","['bitcoin', 'crypto', 'proof', 'stake', 'scam', 'web', 'marketing', 'buzzword', 'nft', 'going', 'zero', 'stablecoin']",0.0,0.15,0.85,-0.5719,Negative
15,15,2022-06-14 08:34:50+00:00,abenz_nft,  love those images   ,"['', 'love', 'those', 'images', '']","['love', 'images']","['love', 'images']",0.677,0.0,0.323,0.6369,Positive
16,16,2022-06-14 08:34:50+00:00,sloothznft,hey  got a fresh jacket     sr sloothzhangwithsloothz ,"['hey', 'got', 'a', 'fresh', 'jacket', 'sr', 'sloothzhangwithsloothz', '']","['hey', 'got', 'fresh', 'jacket', 'sr', 'sloothzhangwithsloothz']","['hey', 'got', 'fresh', 'jacket', 'sr', 'sloothzhangwithsloothz']",0.315,0.0,0.685,0.3182,Positive
17,17,2022-06-14 08:34:49+00:00,joygain72705997,    sol giveaway      prizes         sol     rules       follow         like     tag frens       hr     winner  nft nftgiveaw ,"['', 'sol', 'giveaway', 'prizes', 'sol', 'rules', 'follow', 'like', 'tag', 'frens', 'hr', 'winner', 'nft', 'nftgiveaw', '']","['sol', 'giveaway', 'prizes', 'sol', 'rules', 'follow', 'like', 'tag', 'frens', 'hr', 'winner', 'nft', 'nftgiveaw']","['sol', 'giveaway', 'prizes', 'sol', 'rules', 'follow', 'like', 'tag', 'frens', 'hr', 'winner', 'nft', 'nftgiveaw']",0.482,0.0,0.518,0.8519,Positive
18,18,2022-06-14 08:34:49+00:00,_crypto_alerts,   crypto alert       macd cross alert    m     pair  eos usdt     ipo crypto coinbase nft cryptocurrency     ,"['', 'crypto', 'alert', 'macd', 'cross', 'alert', 'm', 'pair', 'eos', 'usdt', 'ipo', 'crypto', 'coinbase', 'nft', 'cryptocurrency', '']","['crypto', 'alert', 'macd', 'cross', 'alert', 'pair', 'eos', 'usdt', 'ipo', 'crypto', 'coinbase', 'nft', 'cryptocurrency']","['crypto', 'alert', 'macd', 'cross', 'alert', 'pair', 'eos', 'usdt', 'ipo', 'crypto', 'coinbase', 'nft', 'cryptocurrency']",0.286,0.0,0.714,0.5267,Positive
19,19,2022-06-14 08:34:49+00:00,hankai148,       free mint giveaway     azukiart is not only nft  but also a key to mysterious world      congratulations  you are early    ,"['', 'free', 'mint', 'giveaway', 'azukiart', 'is', 'not', 'only', 'nft', 'but', 'also', 'a', 'key', 'to', 'mysterious', 'world', 'congratulations', 'you', 'are', 'early', '']","['free', 'mint', 'giveaway', 'azukiart', 'nft', 'also', 'key', 'mysterious', 'world', 'congratulations', 'early']","['free', 'mint', 'giveaway', 'azukiart', 'nft', 'also', 'key', 'mysterious', 'world', 'congratulations', 'early']",0.319,0.0,0.681,0.8176,Positive
20,20,2022-06-14 08:34:49+00:00,emlish21,emlish      looks like lion      nft nftcollection nftcommunity nftgiveaway nftgiveaways nftproject nfts  ,"['emlish', 'looks', 'like', 'lion', 'nft', 'nftcollection', 'nftcommunity', 'nftgiveaway', 'nftgiveaways', 'nftproject', 'nfts', '']","['emlish', 'looks', 'like', 'lion', 'nft', 'nftcollection', 'nftcommunity', 'nftgiveaway', 'nftgiveaways', 'nftproject', 'nfts']","['emlish', 'looks', 'like', 'lion', 'nft', 'nftcollection', 'nftcommunity', 'nftgiveaway', 'nftgiveaways', 'nftproject', 'nfts']",0.2,0.0,0.8,0.3612,Positive
21,21,2022-06-14 08:34:49+00:00,pierrezandro,unknown places is available for preview on objkt  it is a very collection of pieces of pointcloud art open to mint  ,"['unknown', 'places', 'is', 'available', 'for', 'preview', 'on', 'objkt', 'it', 'is', 'a', 'very', 'collection', 'of', 'pieces', 'of', 'pointcloud', 'art', 'open', 'to', 'mint', '']","['unknown', 'places', 'available', 'preview', 'objkt', 'collection', 'pieces', 'pointcloud', 'art', 'open', 'mint']","['unknown', 'places', 'available', 'preview', 'objkt', 'collection', 'pieces', 'pointcloud', 'art', 'open', 'mint']",0.0,0.0,1.0,0.0,Neutral
22,22,2022-06-14 08:34:49+00:00,xkidlat,   and  were today s laf nft winners  lets see who s next   ,"['', 'and', 'were', 'today', 's', 'laf', 'nft', 'winners', 'lets', 'see', 'who', 's', 'next', '']","['today', 'laf', 'nft', 'winners', 'lets', 'see', 'next']","['today', 'laf', 'nft', 'winners', 'lets', 'see', 'next']",0.256,0.0,0.744,0.4767,Positive
23,23,2022-06-14 08:34:49+00:00,priscil92656050,  nft wizards free mint giveaway      announcing their gold  genesis  wizard pass     cost to mint  free  cost of gas  free  uti ,"['', 'nft', 'wizards', 'free', 'mint', 'giveaway', 'announcing', 'their', 'gold', 'genesis', 'wizard', 'pass', 'cost', 'to', 'mint', 'free', 'cost', 'of', 'gas', 'free', 'uti', '']","['nft', 'wizards', 'free', 'mint', 'giveaway', 'announcing', 'gold', 'genesis', 'wizard', 'pass', 'cost', 'mint', 'free', 'cost', 'gas', 'free', 'uti']","['nft', 'wizards', 'free', 'mint', 'giveaway', 'announcing', 'gold', 'genesis', 'wizard', 'pass', 'cost', 'mint', 'free', 'cost', 'gas', 'free', 'uti']",0.368,0.0,0.632,0.872,Positive
24,24,2022-06-14 08:34:49+00:00,aniyahsjoyce,    oak paradise wl giveaway       prizes    x   wls    to enter      follow     like      tag   fr ,"['', 'oak', 'paradise', 'wl', 'giveaway', 'prizes', 'x', 'wls', 'to', 'enter', 'follow', 'like', 'tag', 'fr', '']","['oak', 'paradise', 'wl', 'giveaway', 'prizes', 'x', 'wls', 'enter', 'follow', 'like', 'tag', 'fr']","['oak', 'paradise', 'wl', 'giveaway', 'prizes', 'x', 'wls', 'enter', 'follow', 'like', 'tag', 'fr']",0.519,0.0,0.481,0.8658,Positive
25,25,2022-06-14 08:34:49+00:00,teeray2920,    nft airdrop giveaway     airdrop     x  sol    x  nft       sol      x       sol      x  ,"['', 'nft', 'airdrop', 'giveaway', 'airdrop', 'x', 'sol', 'x', 'nft', 'sol', 'x', 'sol', 'x', '']","['nft', 'airdrop', 'giveaway', 'airdrop', 'x', 'sol', 'x', 'nft', 'sol', 'x', 'sol', 'x']","['nft', 'airdrop', 'giveaway', 'airdrop', 'x', 'sol', 'x', 'nft', 'sol', 'x', 'sol', 'x']",0.0,0.0,1.0,0.0,Neutral
26,26,2022-06-14 08:34:48+00:00,realblockpi,updates     hiding suspicious nft transfers on opensea     the kujira network s public testnet  harpoon    is l  ,"['updates', 'hiding', 'suspicious', 'nft', 'transfers', 'on', 'opensea', 'the', 'kujira', 'network', 's', 'public', 'testnet', 'harpoon', 'is', 'l', '']","['updates', 'hiding', 'suspicious', 'nft', 'transfers', 'opensea', 'kujira', 'network', 'public', 'testnet', 'harpoon', 'l']","['updates', 'hiding', 'suspicious', 'nft', 'transfers', 'opensea', 'kujira', 'network', 'public', 'testnet', 'harpoon', 'l']",0.0,0.281,0.719,-0.5719,Negative
27,27,2022-06-14 08:34:48+00:00,project_4_nft,  raising    k for  to fund research and legalization efforts of psychedelic treatments for depression and ptsd        b ,"['', 'raising', 'k', 'for', 'to', 'fund', 'research', 'and', 'legalization', 'efforts', 'of', 'psychedelic', 'treatments', 'for', 'depression', 'and', 'ptsd', 'b', '']","['raising', 'k', 'fund', 'research', 'legalization', 'efforts', 'psychedelic', 'treatments', 'depression', 'ptsd', 'b']","['raising', 'k', 'fund', 'research', 'legalization', 'efforts', 'psychedelic', 'treatments', 'depression', 'ptsd', 'b']",0.0,0.209,0.791,-0.5719,Negative
28,28,2022-06-14 08:34:48+00:00,houseamacentral,  take part in the exclusive  challenge  amp  win attractive prizes         burn your mobox momoverse nft avatars ,"['', 'take', 'part', 'in', 'the', 'exclusive', 'challenge', 'amp', 'win', 'attractive', 'prizes', 'burn', 'your', 'mobox', 'momoverse', 'nft', 'avatars', '']","['take', 'part', 'exclusive', 'challenge', 'amp', 'win', 'attractive', 'prizes', 'burn', 'mobox', 'momoverse', 'nft', 'avatars']","['take', 'part', 'exclusive', 'challenge', 'amp', 'win', 'attractive', 'prizes', 'burn', 'mobox', 'momoverse', 'nft', 'avatars']",0.532,0.0,0.468,0.8885,Positive
29,29,2022-06-14 08:34:48+00:00,hadi_ruwadi2,  check out  there giving away    sol    make sure to      follow them      tag   friends         rt    nft nfts nft ,"['', 'check', 'out', 'there', 'giving', 'away', 'sol', 'make', 'sure', 'to', 'follow', 'them', 'tag', 'friends', 'rt', 'nft', 'nfts', 'nft', '']","['check', 'giving', 'away', 'sol', 'make', 'sure', 'follow', 'tag', 'friends', 'rt', 'nft', 'nfts', 'nft']","['check', 'giving', 'away', 'sol', 'make', 'sure', 'follow', 'tag', 'friends', 'rt', 'nft', 'nfts', 'nft']",0.358,0.0,0.642,0.7783,Positive
30,30,2022-06-14 08:34:48+00:00,animalsfarm_nft,  do you need help  ,"['', 'do', 'you', 'need', 'help', '']","['need', 'help']","['need', 'help']",0.474,0.0,0.526,0.4019,Positive
31,31,2022-06-14 08:34:48+00:00,depperainer,  hi tronics   this is operation       we are commissioning a meme fan art contest   price is    st  this     nft by  ,"['', 'hi', 'tronics', 'this', 'is', 'operation', 'we', 'are', 'commissioning', 'a', 'meme', 'fan', 'art', 'contest', 'price', 'is', 'st', 'this', 'nft', 'by', '']","['hi', 'tronics', 'operation', 'commissioning', 'meme', 'fan', 'art', 'contest', 'price', 'st', 'nft']","['hi', 'tronics', 'operation', 'commissioning', 'meme', 'fan', 'art', 'contest', 'price', 'st', 'nft']",0.119,0.0,0.881,0.3182,Positive
32,32,2022-06-14 08:34:48+00:00,bulesky808,  in  ,"['', 'in', '']",[],[],0.0,0.0,1.0,0.0,Neutral
33,33,2022-06-14 08:34:47+00:00,dikdikh33815896,  nft tagosoul airdrop is officially begun        reward        worth of tago token       slots whitelist nft tagosoul     ,"['', 'nft', 'tagosoul', 'airdrop', 'is', 'officially', 'begun', 'reward', 'worth', 'of', 'tago', 'token', 'slots', 'whitelist', 'nft', 'tagosoul', '']","['nft', 'tagosoul', 'airdrop', 'officially', 'begun', 'reward', 'worth', 'tago', 'token', 'slots', 'whitelist', 'nft', 'tagosoul']","['nft', 'tagosoul', 'airdrop', 'officially', 'begun', 'reward', 'worth', 'tago', 'token', 'slots', 'whitelist', 'nft', 'tagosoul']",0.301,0.0,0.699,0.6808,Positive
34,34,2022-06-14 08:34:47+00:00,montagueturner1,    giveaway time      eth is down  so we want to cheer one lucky person up      we are giving away   x luminal genesis nft i ,"['', 'giveaway', 'time', 'eth', 'is', 'down', 'so', 'we', 'want', 'to', 'cheer', 'one', 'lucky', 'person', 'up', 'we', 'are', 'giving', 'away', 'x', 'luminal', 'genesis', 'nft', 'i', '']","['giveaway', 'time', 'eth', 'want', 'cheer', 'one', 'lucky', 'person', 'giving', 'away', 'x', 'luminal', 'genesis', 'nft']","['giveaway', 'time', 'eth', 'want', 'cheer', 'one', 'lucky', 'person', 'giving', 'away', 'x', 'luminal', 'genesis', 'nft']",0.372,0.0,0.628,0.8434,Positive
35,35,2022-06-14 08:34:47+00:00,fatimah68150836,  newnftprofilepic nft by      my love and soulmate just gave me the most coveted nft     i can t wish for a bet ,"['', 'newnftprofilepic', 'nft', 'by', 'my', 'love', 'and', 'soulmate', 'just', 'gave', 'me', 'the', 'most', 'coveted', 'nft', 'i', 'can', 't', 'wish', 'for', 'a', 'bet', '']","['newnftprofilepic', 'nft', 'love', 'soulmate', 'gave', 'coveted', 'nft', 'wish', 'bet']","['newnftprofilepic', 'nft', 'love', 'soulmate', 'gave', 'coveted', 'nft', 'wish', 'bet']",0.419,0.0,0.581,0.8957,Positive
36,36,2022-06-14 08:34:47+00:00,nfttimee,   bigfoot town x apple       x  sol    x wl bigfoot town      to enter       follow    amp    amp   ,"['', 'bigfoot', 'town', 'x', 'apple', 'x', 'sol', 'x', 'wl', 'bigfoot', 'town', 'to', 'enter', 'follow', 'amp', 'amp', '']","['bigfoot', 'town', 'x', 'apple', 'x', 'sol', 'x', 'wl', 'bigfoot', 'town', 'enter', 'follow', 'amp', 'amp']","['bigfoot', 'town', 'x', 'apple', 'x', 'sol', 'x', 'wl', 'bigfoot', 'town', 'enter', 'follow', 'amp', 'amp']",0.0,0.0,1.0,0.0,Neutral
37,37,2022-06-14 08:34:46+00:00,annelie00284967,  nft wizards free mint giveaway      announcing their gold  genesis  wizard pass     cost to mint  free  cost of gas  free  uti ,"['', 'nft', 'wizards', 'free', 'mint', 'giveaway', 'announcing', 'their', 'gold', 'genesis', 'wizard', 'pass', 'cost', 'to', 'mint', 'free', 'cost', 'of', 'gas', 'free', 'uti', '']","['nft', 'wizards', 'free', 'mint', 'giveaway', 'announcing', 'gold', 'genesis', 'wizard', 'pass', 'cost', 'mint', 'free', 'cost', 'gas', 'free', 'uti']","['nft', 'wizards', 'free', 'mint', 'giveaway', 'announcing', 'gold', 'genesis', 'wizard', 'pass', 'cost', 'mint', 'free', 'cost', 'gas', 'free', 'uti']",0.368,0.0,0.632,0.872,Positive
38,38,2022-06-14 08:34:46+00:00,freddyg48326594,       free mint giveaway     azukiart is not only nft  but also a key to mysterious world      congratulations  you are early    ,"['', 'free', 'mint', 'giveaway', 'azukiart', 'is', 'not', 'only', 'nft', 'but', 'also', 'a', 'key', 'to', 'mysterious', 'world', 'congratulations', 'you', 'are', 'early', '']","['free', 'mint', 'giveaway', 'azukiart', 'nft', 'also', 'key', 'mysterious', 'world', 'congratulations', 'early']","['free', 'mint', 'giveaway', 'azukiart', 'nft', 'also', 'key', 'mysterious', 'world', 'congratulations', 'early']",0.319,0.0,0.681,0.8176,Positive
39,39,2022-06-14 08:34:46+00:00,animalsfarm_nft,  don t lie to me  i see right through you   ,"['', 'don', 't', 'lie', 'to', 'me', 'i', 'see', 'right', 'through', 'you', '']","['lie', 'see', 'right']","['lie', 'see', 'right']",0.0,0.0,1.0,0.0,Neutral
40,40,2022-06-14 08:34:46+00:00,lordcalder,want something different  look at this nft  ,"['want', 'something', 'different', 'look', 'at', 'this', 'nft', '']","['want', 'something', 'different', 'look', 'nft']","['want', 'something', 'different', 'look', 'nft']",0.178,0.0,0.822,0.0772,Positive
41,41,2022-06-14 08:34:46+00:00,sagor_hossain__,move earn nft nfts metaverse ido runx    i think this project will be successful as transparency and safety is  ,"['move', 'earn', 'nft', 'nfts', 'metaverse', 'ido', 'runx', 'i', 'think', 'this', 'project', 'will', 'be', 'successful', 'as', 'transparency', 'and', 'safety', 'is', '']","['move', 'earn', 'nft', 'nfts', 'metaverse', 'ido', 'runx', 'think', 'project', 'successful', 'transparency', 'safety']","['move', 'earn', 'nft', 'nfts', 'metaverse', 'ido', 'runx', 'think', 'project', 'successful', 'transparency', 'safety']",0.292,0.0,0.708,0.765,Positive
42,42,2022-06-14 08:34:46+00:00,bzusupova,    nftgiveaway        x       eth   x  funkopop toy   x  pop    x  pop    x nft    webstore ht ,"['', 'nftgiveaway', 'x', 'eth', 'x', 'funkopop', 'toy', 'x', 'pop', 'x', 'pop', 'x', 'nft', 'webstore', 'ht', '']","['nftgiveaway', 'x', 'eth', 'x', 'funkopop', 'toy', 'x', 'pop', 'x', 'pop', 'x', 'nft', 'webstore', 'ht']","['nftgiveaway', 'x', 'eth', 'x', 'funkopop', 'toy', 'x', 'pop', 'x', 'pop', 'x', 'nft', 'webstore', 'ht']",0.0,0.0,1.0,0.0,Neutral
43,43,2022-06-14 08:34:46+00:00,tkirwi,  nft wizards free mint giveaway      announcing their gold  genesis  wizard pass     cost to mint  free  cost of gas  free  uti ,"['', 'nft', 'wizards', 'free', 'mint', 'giveaway', 'announcing', 'their', 'gold', 'genesis', 'wizard', 'pass', 'cost', 'to', 'mint', 'free', 'cost', 'of', 'gas', 'free', 'uti', '']","['nft', 'wizards', 'free', 'mint', 'giveaway', 'announcing', 'gold', 'genesis', 'wizard', 'pass', 'cost', 'mint', 'free', 'cost', 'gas', 'free', 'uti']","['nft', 'wizards', 'free', 'mint', 'giveaway', 'announcing', 'gold', 'genesis', 'wizard', 'pass', 'cost', 'mint', 'free', 'cost', 'gas', 'free', 'uti']",0.368,0.0,0.632,0.872,Positive
44,44,2022-06-14 08:34:46+00:00,saucycarlos,   hellyeeah  who don t love dust  check out  they are minting rn      dust   day per nft ,"['', 'hellyeeah', 'who', 'don', 't', 'love', 'dust', 'check', 'out', 'they', 'are', 'minting', 'rn', 'dust', 'day', 'per', 'nft', '']","['hellyeeah', 'love', 'dust', 'check', 'minting', 'rn', 'dust', 'day', 'per', 'nft']","['hellyeeah', 'love', 'dust', 'check', 'minting', 'rn', 'dust', 'day', 'per', 'nft']",0.231,0.0,0.769,0.6369,Positive
45,45,2022-06-14 08:34:46+00:00,heidily31177539,    wl giveaway      since the team is launching the full website next week  i m giving away     summon list  wl  spo ,"['', 'wl', 'giveaway', 'since', 'the', 'team', 'is', 'launching', 'the', 'full', 'website', 'next', 'week', 'i', 'm', 'giving', 'away', 'summon', 'list', 'wl', 'spo', '']","['wl', 'giveaway', 'since', 'team', 'launching', 'full', 'website', 'next', 'week', 'giving', 'away', 'summon', 'list', 'wl', 'spo']","['wl', 'giveaway', 'since', 'team', 'launching', 'full', 'website', 'next', 'week', 'giving', 'away', 'summon', 'list', 'wl', 'spo']",0.124,0.0,0.876,0.34,Positive
46,46,2022-06-14 08:34:46+00:00,tylerscryypt0,    free nft giveaway     drop your  eth address  follow  amp  rt   opensea ,"['', 'free', 'nft', 'giveaway', 'drop', 'your', 'eth', 'address', 'follow', 'amp', 'rt', 'opensea', '']","['free', 'nft', 'giveaway', 'drop', 'eth', 'address', 'follow', 'amp', 'rt', 'opensea']","['free', 'nft', 'giveaway', 'drop', 'eth', 'address', 'follow', 'amp', 'rt', 'opensea']",0.229,0.146,0.625,0.296,Positive
47,47,2022-06-14 08:34:46+00:00,man_gusyan,  just registered for the lilchimps on   ,"['', 'just', 'registered', 'for', 'the', 'lilchimps', 'on', '']","['registered', 'lilchimps']","['registered', 'lilchimps']",0.0,0.0,1.0,0.0,Neutral
48,48,2022-06-14 08:34:46+00:00,francis79169088,       free mint giveaway     azukiart is not only nft  but also a key to mysterious world      congratulations  you are early    ,"['', 'free', 'mint', 'giveaway', 'azukiart', 'is', 'not', 'only', 'nft', 'but', 'also', 'a', 'key', 'to', 'mysterious', 'world', 'congratulations', 'you', 'are', 'early', '']","['free', 'mint', 'giveaway', 'azukiart', 'nft', 'also', 'key', 'mysterious', 'world', 'congratulations', 'early']","['free', 'mint', 'giveaway', 'azukiart', 'nft', 'also', 'key', 'mysterious', 'world', 'congratulations', 'early']",0.319,0.0,0.681,0.8176,Positive
49,49,2022-06-14 08:34:46+00:00,absolom40857995,   secret alpha labs x nubbies     we are giving away  x spots     to enter           like       follow    ,"['', 'secret', 'alpha', 'labs', 'x', 'nubbies', 'we', 'are', 'giving', 'away', 'x', 'spots', 'to', 'enter', 'like', 'follow', '']","['secret', 'alpha', 'labs', 'x', 'nubbies', 'giving', 'away', 'x', 'spots', 'enter', 'like', 'follow']","['secret', 'alpha', 'labs', 'x', 'nubbies', 'giving', 'away', 'x', 'spots', 'enter', 'like', 'follow']",0.308,0.0,0.692,0.5994,Positive
